,author,developer_reply,review,review_date,reviewer_ratings,star
0,풀메탈,," 저는 잘 사용하고 있어요. 근데 건의할게 있어요. 이체할때 실시간 잔금이 나오면 좋을거 같아요. 예를들면 통장 잔고가 10이고, 보내는 금액이 5이면 통장잔고5가 바로 보이게요. 통장 잔금을 딱 이만큼만 남기고 싶을때 엄청 편할거 같아요.",2021년 2월 21일,54,별표 5개 만점에 4개를 받았습니다.
1,김영후,," 자주쓰는 계좌 등록이 없어서 매달.새로작성. 관리비,세금. 국세 자동이체는 전혀안되는 은행 제발 분발좀 다른은행으로 주거래처 교체예정 아! 이체한도를 올리려니 뭐그렇게 까다롭게 구는지 내통안내돈도 허락받고 보내야하고...아직 불편함이 많은금용업체입니다",2021년 2월 22일,52,별표 5개 만점에 2개를 받았습니다.
2,혜지,, 모바일 앱 로그인이 되지않아 고객센터 안내 받아 앱 삭제후 재설치하는데 재설치 조차 안되네요. 당장 빨리 사용해야하는데. 답답하고 짜증나네요. 일요일이라 고객센터도 제대로 연결안되며 담당 부서가 아니라 자세히 모른다는 답변뿐. 당장 급하게 사용해야하는데 지금 3시간째 앱 때문에 애 먹고 있네요 로그인 되면 다 이체시키고 다신 사용 안하려고 합니다. 앱 로그인조차 안되고 안내도 제대로 되지않는데 급한사람은 어떡하라는겁니까.,2021년 2월 7일,51,별표 5개 만점에 1개를 받았습니다.
3,PrADᅡ KᅵllᄐR,," 계좌송금시, 금액부터 적는게 아니라 받을사람 계좌정보부터 쓰고 확인한 후에 보낼 금액 적으면 오송금으로 인한 불편을 줄일 수 있을거라 생각됩니다. 비대면금융의 선두주자인 카카오 뱅크가 솔선수범해주기 바랍니다.",2021년 2월 14일,53,별표 5개 만점에 3개를 받았습니다.
4,Krystal Loveya,," 갤s10e one ui 3.0 업데이트 이후 루팅된 폰으로 인식해서 정상접속이 차단되었습니다. 어떻게 해야 할까요? 카뱅으로 처리해야할 문제들이 있는데, 갑자기 이렇게 되니 정말 당황스럽고 어이가없네요..;;",2021년 2월 4일,51,별표 5개 만점에 1개를 받았습니다.
5,고현진,, 카카오뱅크 깔끔하고 좋아요 하지만 아쉬운 부분이 많이 있습니다 체크카드 도착하기 전까지 사용하고 싶어도 못하는 부분이 아쉽고 실망입니다 체크 도착하기 전까지 온라인으로 삼성페이 간편결제 등록할 수 있게 만들면 좋겠습니다,2021년 2월 11일,53,별표 5개 만점에 3개를 받았습니다.
6,허정현,, 밑에도 저랑 같은 증상인분 있는데 s10 5g고 잘 사용하다가 오늘 사용할려니까 루팅기기라고 접속이 안돼요 루팅하지도 않고 하는법도 모르는데 하 앱을 못 켜니까 고객센터문의도 못하고 이거 언제 고치나요,2021년 2월 15일,51,별표 5개 만점에 1개를 받았습니다.
7,_미우,, 디자인이 예뻐서 좋아요 노랑색깔을 여러가지 색으로 바꿀수있고 계좌 제목도 바꿀수있고 < 이 두가지는 업뎃해서 절대바꾸시지 않았음 좋겠어요,2021년 2월 20일,55,별표 5개 만점에 5개를 받았습니다.
8,DJ Oh,, 이체할때 일시적인 오류로 안된다고 몇시간동안 이체 못하는경우있습니다. 다시 삭제하고 인증해야되는 경우도 있고요. 진짜 잘쓰다가도 너무 열받네요. 지금도 그러고있어서 리뷰씁니다,2021년 2월 6일,52,별표 5개 만점에 2개를 받았습니다.
9,양손볼러tv.,, 카메라인식이 안되면 직접입력란도 만들어주세요 카메라가 고장나서 로그인을 할수가 없네요 돈이 다 그안에있는데 카드도 분실상태라 완전 돈이 묶여있습니다 꼭 답장바랍니다,2021년 2월 11일,52,별표 5개 만점에 2개를 받았습니다.
10,김현준,, 미니카드에 카카오페이로 돈을 넣었는데 대중교통을 이용할때 잔액이 부족하다고 하더라고요 친구한테 물어보니 편의점에서 버스카드 충전을해야 쓸수있다고하는데 어떤 방식으로 충전하더라도 버스비도 되고 편의점 결제도 되도록 바꿔주시면 좋을거 같습니다,2021년 2월 1일,53,별표 5개 만점에 3개를 받았습니다.
11,Cicada,, 폰 업데이트하고 루팅어쩌고하면서 실행 안되시는 분들 카카오뱅크 삭제하고 다시깔아서 인증하면 실행됩니다.,2021년 2월 23일,51,별표 5개 만점에 1개를 받았습니다.
12,노진용,," 예전에 만든계좌 비밀번호,패턴 모두 잊어버려서 본인인증 다하고 신분증 사진도 인증 다 했는데 마지막에 영상통화를 해야한다해서 3번씩이나 요청을 했는데 인증도 안들어오고 아무런 조치가 없네요 이건 그냥 뭐 쓰지말라는건가요? 일부러 고객센터 업무시간에도 인증요청을 했는데 아무런 조치가 없네요^^",2021년 2월 6일,51,별표 5개 만점에 1개를 받았습니다.
13,쮸쮸,, 학생증으로 미니 인증 비밀번호 재설정 할 수 있게 해주세요 신분증도 없고 계좌도 없어서 잃어버린 비밀번허 재설정이 불가능하네요 진위 여부는 영상통화로 확인이 가능하잖아요,2021년 2월 8일,52,별표 5개 만점에 2개를 받았습니다.
14,악도,, 비밀번호 및 보안 패턴을 만들었음에 카톡 계정으로 하려는데 다시 만들어라 및 일치하지 않습니다는 대체 뭔가요? 이부분 수정바랍니다,2021년 2월 9일,51,별표 5개 만점에 1개를 받았습니다.
15,임기성,, 카뱅카드 인증비밀번호를 까먹었는데 여권이랑 개인카드가없어서 못바꾸고있네요 전화번호나 다른 방법으로 바꿀수있으면 좋겠습니다,2021년 2월 5일,55,별표 5개 만점에 5개를 받았습니다.
16,이름,, 쿠팡이라는 앱에서 결제하려고 하는데 비밀번호도 맞게 했는데 해당계좌상태이상으로 결제가 안된다네요 이럴때 어떡하나요ㅜ,2021년 2월 11일,51,별표 5개 만점에 1개를 받았습니다.
17,계공이,, 계좌 만드려고 실명인증 하는데 자꾸 정보가 일치하지 않다고 떠요 이름이랑 주민번호 확실하게 맞는데; 아 개짜증나네,2021년 2월 14일,51,별표 5개 만점에 1개를 받았습니다.
18,전현민,, 물건이네요. 같지만 다른은행. 사용자 경험 너무좋습니다.,2021년 2월 9일,55,별표 5개 만점에 5개를 받았습니다.
19,Sung Won Jeong,," 낮은 금리, 넉넉한 한도로 광고하여 마이너스 통장 대출 신청하였더니 당사의 기준에 한도가 부족하여 대출이 불가하다고 통보됩디다.. 불가한 사유에 대해 자세한 내용을 알고 싶으면 고객센터로 전화하라고 하여 그렇게 했더니 돌아오는 답변은 자기들도 잘 모르겠다고 합디다.. 신용이 나쁜것도 아니고 타행 대출이 소득에 비해 많은것도 아닌데 한도가 안 나오는 이유를 모르겠다고 합디다.. 타은행보다 낮은 금리로 서민을 혹하여 대출신청 실적을 올리려는건가요? 돈이 필요하여 대출을 신청한 것이 아니라 어려운 시기에 이자지출을 줄이기 위해 광고를 보...전체 리뷰낮은 금리, 넉넉한 한도로 광고하여 마이너스 통장 대출 신청하였더니 당사의 기준에 한도가 부족하여 대출이 불가하다고 통보됩디다.. 불가한 사유에 대해 자세한 내용을 알고 싶으면 고객센터로 전화하라고 하여 그렇게 했더니 돌아오는 답변은 자기들도 잘 모르겠다고 합디다.. 신용이 나쁜것도 아니고 타행 대출이 소득에 비해 많은것도 아닌데 한도가 안 나오는 이유를 모르겠다고 합디다.. 타은행보다 낮은 금리로 서민을 혹하여 대출신청 실적을 올리려는건가요? 돈이 필요하여 대출을 신청한 것이 아니라 어려운 시기에 이자지출을 줄이기 위해 광고를 보고 신청한건데 기만당한 기분입니다.",2021년 1월 26일,51,별표 5개 만점에 1개를 받았습니다.
20,김병주,," 카카오뱅크 저금통기능 너무 잘 쓰고 있는데요. 문득, 누군가가 불특정 다수에게 ""저금통"" 이라는 이름으로 자동이체로 소액을 출금하고 있다면, 장기간동안 들키지 않겠다고 생각이 들었네요. 이유1. 저금통에 출금되는 금액이 정해지지않고 주기도 일정치 않다. (돈이 출금되어도 저금통인갑다 하고 넘어가겠죠.) 이유2. 사용자는 저금통 잔금확인을 1주일에 1회밖에 하지 못한다. (계좌에서 빠져나간 금액이 저금통으로 얼마나 쌓였는지 그때그때 확인이 불가능하니까요.) 이유3. 저금통으로 나간 금액은 소액에다 여러번 이기 때문에 그것을 일일히 계...전체 리뷰카카오뱅크 저금통기능 너무 잘 쓰고 있는데요. 문득, 누군가가 불특정 다수에게 ""저금통"" 이라는 이름으로 자동이체로 소액을 출금하고 있다면, 장기간동안 들키지 않겠다고 생각이 들었네요. 이유1. 저금통에 출금되는 금액이 정해지지않고 주기도 일정치 않다. (돈이 출금되어도 저금통인갑다 하고 넘어가겠죠.) 이유2. 사용자는 저금통 잔금확인을 1주일에 1회밖에 하지 못한다. (계좌에서 빠져나간 금액이 저금통으로 얼마나 쌓였는지 그때그때 확인이 불가능하니까요.) 이유3. 저금통으로 나간 금액은 소액에다 여러번 이기 때문에 그것을 일일히 계산해보는 사람은 매우 드물것이다. 물론. 카카오뱅크 이체 내역을 눌러보면 ""저금통""인지 ""일반이체""인지 ""자동이체"" 인지 알겠지만, 그걸 일일히 확인하는 사람이 얼마나 될까요?",2021년 1월 30일,53,별표 5개 만점에 3개를 받았습니다.
21,JinSIk Rho,, 스마트 OTP는 왜 지원이 안되는건가요?? 카카오뱅크 때문에 OTP를 재발급 받아야 하는건 불합리해 보입니다. 스마트 OTP지원 일정이 나왔으면 확인 요청 드립니다,2021년 2월 1일,51,별표 5개 만점에 1개를 받았습니다.
22,전은지,, 계속 에러나고 로그인안됨 뭐하자는거지 어플 이따위로 만들어서 사용자 화병나게 할 생각인가....,2021년 2월 9일,51,별표 5개 만점에 1개를 받았습니다.
23,김은경,, 업데이트하고 들어갈때 로딩이 너무 길어졌어요 ㅜㅜ 급할때 불편하네용,2021년 2월 8일,53,별표 5개 만점에 3개를 받았습니다.
24,전종문,, 갑자기 기기등록취소됐다고하고 등록을 왜 계속하나요 신분증 도대체 몇번이나찍으라는거여요,2021년 2월 2일,51,별표 5개 만점에 1개를 받았습니다.
25,조용한 쉼터,, 제가 한 3일정도 잘 사용했었고 카트도 만들었은데 갑자기 오늘 들어가서 계좌번호를 확인할려고 했더니 계속 튕기고 종료되서 받아야했던 돈을 이체 받지 못해서 불편함이 있었네요. 빠른 시일내에 버그 수정 부탁드립니다. 운영자님 그외에는 정말 만족하고 있습니다.😁,2021년 1월 1일,53,별표 5개 만점에 3개를 받았습니다.
26,박세빈,, 입출금 계좌 계설하려다가 뭘 잘못 눌러서 이전화면으로 넘어가고 싶은데 이전화면으로 넘어가거나 아예 처음부터 다시 시작 할 수 있게 해주는 기능이 없는게 많이 아쉽네요. 30일씩이나 기다려서 새로 해야 하나요ㅠ,2021년 1월 26일,53,별표 5개 만점에 3개를 받았습니다.
27,내이름,, 아주편하게 사용하고있었는데(겔럭시s20사용중)소프트웨어업데이트후에 카카오뱅크가 실행이되질않습니다.. 루팅으로변형된 운영체제 기기라고 뜨고 카뱅 업데이트를 안했나?하고 업데이트하려니까 (6번째시도중)84%에서 진전이없고 멈춰있습니다,2020년 12월 22일,52,별표 5개 만점에 2개를 받았습니다.
28,최화영,," 자꾸 카드내역을 볼려고 하면 오류가 떠서 튕깁니다. 앱을 삭제했다가 다시 깔기도 하고, 폰도 껐다가 다시 켜보기도 하고 제가 할 수 있는 것은 다 해 봤지만 오류가 해결되지않네요. 답변 부탁드립니다.",2021년 1월 1일,51,별표 5개 만점에 1개를 받았습니다.
29,별빛,, 다른거 다 좋고 이때까지 잘 써왔는데 어제부터 계속 실행이 잘 안되더라구요~ 뭐 좀 하려고만 하면 카카오뱅크가 계속 중단됨 이라 뜨고ㅠㅠㅠ1월 1일이니까 그런가 싶어서 오늘까지 기다렸는데 오늘도 똑같은 현상이 계속 나타나서 리뷰남겨요. 찾아보니 다른 분들도 똑같은 상황을 겪고 계시더라구요ㅠ,2021년 1월 2일,53,별표 5개 만점에 3개를 받았습니다.
30,네버버랜드,, 미니카드가 출시하고나서부터 사용했는데 굉장히 편합니다! 친구끼리 돈모으거나 빌려줄때도 예전에는 현금으로 만나서 했지만 지금은 계좌이체만 라면 되니 매우편리합니다 또 부모님께 용돈 받을때도 계좌로 받으면 되고..진짜 미니카드 출시는 신의 한수인듯 합니다,2021년 2월 3일,55,별표 5개 만점에 5개를 받았습니다.
31,레전드,, S20 사용자입니다 소프트웨어 업데이트 후 루팅된 기기라며 오류로 인해 실행이 되지 않습니다. 루팅 한적도 없으며 다른 은행어플은 잘 실행됩니다 빠른 조치 부탁드리겠습니다.,2020년 12월 31일,51,별표 5개 만점에 1개를 받았습니다.
32,영가리,, 신분증확인 오류가 계속 나서 문의를 해보니깐 할 수 있는게 없다는데 이럴꺼면 프로그램이라도 똑바로 만들어서 인식을 제대로 하게 만들던가 이런 문제에 대처할수있게 고객센터에서 처리를 하던가 해야하는데 아무것도 못하면 거기에 고객센터는 왜있고 문의기능은 왜 만든건지,2020년 12월 25일,51,별표 5개 만점에 1개를 받았습니다.
33,정유석,, 아.. 다좋은데요 카뱅에서 추천하는대출상품 신청햇다가 지금 대출전화가 장난아니네요 매일 오전오후로 전화오고.문자오고 스트레스받아서 미처버릴거같습니다 일반은행에서는 대출받으라는 문자 보내지않는걸로 알고잇는데 어디로 개인정보 팔은거에요? 신한.국민.등등 5%로 어쩌구 대출전화.문자 일체없이살앗는데 ....,2020년 12월 30일,54,별표 5개 만점에 4개를 받았습니다.
34,소년,," 계좌개설만하고 한번도 사용하지 않고 있다가, 오랜만에 들어가려니 패턴비밀번호도 잊어버렸고, 계좌 비밀번호도 잊어버렸습니다. 오로지 인증비밀번호 6자리만 기억한채... 저도 저 스스로 어이없다고 생각하지만, 해결하고자 고객센터에 문의를 했고, 영상통화 종료 후 영상통화가 종료되었습니다. 확인버튼을 누르면 재설정 창이 뜬다고 하였지만, 어쩐일인지 영상통화 3번을 해도 뜨지 않았습니다. 고객센터 상담사분들도 처음 겪은 일이신지... 상담사가 먼저 전화를 끊게 해보라는 해결책과 실행중인 어플을 어떻게 해보라는 등의 해결책을 제시해주셨지만,...전체 리뷰계좌개설만하고 한번도 사용하지 않고 있다가, 오랜만에 들어가려니 패턴비밀번호도 잊어버렸고, 계좌 비밀번호도 잊어버렸습니다. 오로지 인증비밀번호 6자리만 기억한채... 저도 저 스스로 어이없다고 생각하지만, 해결하고자 고객센터에 문의를 했고, 영상통화 종료 후 영상통화가 종료되었습니다. 확인버튼을 누르면 재설정 창이 뜬다고 하였지만, 어쩐일인지 영상통화 3번을 해도 뜨지 않았습니다. 고객센터 상담사분들도 처음 겪은 일이신지... 상담사가 먼저 전화를 끊게 해보라는 해결책과 실행중인 어플을 어떻게 해보라는 등의 해결책을 제시해주셨지만, 비밀번호 재설정 창은 결국 뜨지 않았습니다. 저의 계좌와 정보가 카카오뱅크에 있지만, 어플을 들어가보지도 못한채 어플을 삭제할 예정입니다ㅋㅋㅋ저도 제가 어이가 없지만, 이런 경우가 저만 있지는 않을 것 같거든요. 이런 경우를 카카오뱅크 개발팀 쪽에선 생각을 안해보신건지... 한번도 사용하지 않은것을 다행으로 생각하고 찝찝하게 어플을 지워야겠습니다. 갤8+",2020년 12월 18일,51,별표 5개 만점에 1개를 받았습니다.
35,Editor Mind,, 계좌 만드는 과정에서 본인인증 할 때 상담원과 화상통화랑 통장인증 중 통장인증을 선택했더니 통장인증은 계속 오류가 뜨고 상담원과 화상통화로 인증하려고 했더니 뒤로가기도 안되네요? 어플엔 이어서하기 버튼밖에 없고 무슨 30일 후에 이어서하기가 없어진다고 뜨던데 그러면 30일 후에 계좌를 만들 수 있는건가요? 뭐 이딴식으로 만들어놨지 당연히 처음부터 다시 돌아가서 할 수 있는거랑 이어서 하는거랑 선택할 수 있어야지 이어서하기 밖에 없으면 통장 인증을 못 하는 사람이 화상으로 인증하려고 하면 30일 기다려서 이어서하기가 삭제되어야만 다시...전체 리뷰계좌 만드는 과정에서 본인인증 할 때 상담원과 화상통화랑 통장인증 중 통장인증을 선택했더니 통장인증은 계속 오류가 뜨고 상담원과 화상통화로 인증하려고 했더니 뒤로가기도 안되네요? 어플엔 이어서하기 버튼밖에 없고 무슨 30일 후에 이어서하기가 없어진다고 뜨던데 그러면 30일 후에 계좌를 만들 수 있는건가요? 뭐 이딴식으로 만들어놨지 당연히 처음부터 다시 돌아가서 할 수 있는거랑 이어서 하는거랑 선택할 수 있어야지 이어서하기 밖에 없으면 통장 인증을 못 하는 사람이 화상으로 인증하려고 하면 30일 기다려서 이어서하기가 삭제되어야만 다시 처음부터 시작해서 계좌를 만들 수 있겠네요 그냥 다른 어플 쓸랍니다,2020년 12월 25일,51,별표 5개 만점에 1개를 받았습니다.
36,무스너클사장님,, 얼마전까지만해도 잘 쓰고았다가 어느날 카드 사용내역을 보려고 하니까 계속 튕기네요 그래서 이상해서 지웠다 다시 깔았는데도 불구하고 계속 튕기네요. 빨리고쳐주세요 불편해요,2021년 1월 1일,52,별표 5개 만점에 2개를 받았습니다.
37,섯세취,, 진짜 좋아요 수수료 안붙는거 최고!,2021년 2월 13일,55,별표 5개 만점에 5개를 받았습니다.
38,진혜련,, 환불요청은안되고 적금같은건바로나가네요 그래서안쓰고싶어요,2021년 2월 12일,51,별표 5개 만점에 1개를 받았습니다.
39,유말교,, 이체할때 돈 찾아쓸때 수수료 없어서 좋구요 다른곳으로 이체시킬때 간단하고 편해요. 다른은행과 다른점은 복잡하지않고 간단하다는것 잘 활용하겠습니다,2020년 12월 18일,55,별표 5개 만점에 5개를 받았습니다.
40,김청국짱,, 니니즈 체크카드 성인도 만들 수 있게 해주세요 가능할때까지 체크카드 발급 참겠습니다....,2021년 2월 18일,53,별표 5개 만점에 3개를 받았습니다.
41,Sophie Yoo,, 다 너무 좋은데 카카오뱅크 체크카드 신청한지 1주일 됐는데 아직도 체크카드가 안 오고 카카오뱅크에 전화해도 언제 받을지 모른단 소리만 듣네요. 택배사도 무슨 국제택배라는 업체 쓰는데 이 업체 따로 앱도 없어서 알 수가 없구요. 택배업체에 전화 3번했는데 통화량많다고 연결안된다고 끊어져요. 카카오뱅크에 전화해도 택배사한테 전화해보란 소리만하시고 다른 택배사(앱 있고 전화가능한 우체국이나CJ) 통해서 카드받을 수 있냐고 물었는데 그건 안된다고 하네요. 체크카드 담당 택배사 좀 바꾸세요. 체크카드 신청하고 이런 듣보잡 택배사로 선정해서 ...전체 리뷰다 너무 좋은데 카카오뱅크 체크카드 신청한지 1주일 됐는데 아직도 체크카드가 안 오고 카카오뱅크에 전화해도 언제 받을지 모른단 소리만 듣네요. 택배사도 무슨 국제택배라는 업체 쓰는데 이 업체 따로 앱도 없어서 알 수가 없구요. 택배업체에 전화 3번했는데 통화량많다고 연결안된다고 끊어져요. 카카오뱅크에 전화해도 택배사한테 전화해보란 소리만하시고 다른 택배사(앱 있고 전화가능한 우체국이나CJ) 통해서 카드받을 수 있냐고 물었는데 그건 안된다고 하네요. 체크카드 담당 택배사 좀 바꾸세요. 체크카드 신청하고 이런 듣보잡 택배사로 선정해서 언제 올지 알 수가 없고 카뱅에선 이건 진짜 흠이네요.,2020년 12월 29일,51,별표 5개 만점에 1개를 받았습니다.
42,Minyoung Chang,, 모임에 유용합니다. 다만 멤버별 입금현황에 멤버별 출금한 돈 또한 계산되어 보여지면 관리에 용의할 것 같습니다. 입금현황만 보니 액수 안맞는 원인 찾기가 어려웠습니다.,2021년 1월 23일,54,별표 5개 만점에 4개를 받았습니다.
43,Moon하영,, 융통성 1도 없는 어플 ㅡㅡ... 2년 전에 썼다가 안써서 하나도 기억 안 나는데 한 번 비번 초기화 하려면 화상통화를 3번이나 하게 하나요?;;; 한번으로 연동되는 것도 아니고... 카카오에 큰 실망했습니다..,2021년 1월 25일,51,별표 5개 만점에 1개를 받았습니다.
44,백승일,, K뱅크 앱처럼 종료 후에 앱 히스토리에 안나오게 해주세요. 카카오뱅크앱은 앱 히스토리에 잔고내역이 나옵니다... 개인정보 유출입니다...,2021년 2월 4일,54,별표 5개 만점에 4개를 받았습니다.
45,카식이,, 너무좋아요 우연히SNS에서 보다가 카뱅 미니라는 카드를 이벤트 하길레 한번 신청했는데 너무좋고 미니카드기다린 보람이 있네요 돈을 입금해도 수수료가 안나오고 있는돈 그대로 입금되니까 너무좋아요,2021년 1월 1일,55,별표 5개 만점에 5개를 받았습니다.
46,튜브님,, 처음에 가입할때만 만 14세 미만 부모님 절차 뜨네요 계좌 만들 때도 떠야하는거 아닌가요? 법 보니 법정대리인 동의 없으면 만들수없다던데 받았는데 그래서 가입했고 근데 계좌 개설에서 막히네요? 왜그래요? 그럴거면 가입부터 막아두시든가요,2021년 2월 20일,51,별표 5개 만점에 1개를 받았습니다.
47,tioyo티오요,, 카드 입출금내역 보려고 눌렀더니 자꾸 앱이 꺼지네요 뭐가 문제인 지도 모르겠고 며칠째 이러네요 해결법이 있나요?,2021년 1월 1일,51,별표 5개 만점에 1개를 받았습니다.
48,유가영,, 26주 적금으로 시작했습니다 사용해보니 여러 소소하지만 꼭 필요한 기능들이 많아서 좋았구요 간편하게 사용하기 좋아서 애용중입니다,2020년 12월 24일,55,별표 5개 만점에 5개를 받았습니다.
49,조혜민,, 평소에 정말 잘 사용하고있었는데 사용내역 조회하려고만 하면 튕기네요 빨리 해결해주셔야 할 것 같습니다,2021년 1월 1일,53,별표 5개 만점에 3개를 받았습니다.
50,김민정,, 갑자기 로딩만되고 들어가지질 않아요,2021년 2월 9일,51,별표 5개 만점에 1개를 받았습니다.
51,김희철,, 아니;;;새로고침표시 계속떠서 뭘 할수가없네요??;;; 통장계설하는데 20분걸리는게 말이되나...,2020년 12월 29일,51,별표 5개 만점에 1개를 받았습니다.
52,고고,, 다 좋은데 mini도 적금이나 저금통 같은거 만들어 주시면 안될까요 ?? 제가 미성년자인데 돈이 쌓이면 막 쓰다보니 정말 필요하다고 느껴지는데 만들어 주셨으면 정말 좋겠습니다.. 진짜 부탁드립니다..,2020년 12월 18일,55,별표 5개 만점에 5개를 받았습니다.
53,이창우,, 체크카드색상이2가지밖에뜨지않는다 녹색이뜨면별5개줌,2021년 2월 9일,51,별표 5개 만점에 1개를 받았습니다.
54,김호선,," 사용하기 편하고 송금, 결재, 적금등 다양하게 사용할수 있어서 정말 좋습니다. 굿! 입니다.",2020년 12월 29일,55,별표 5개 만점에 5개를 받았습니다.
55,서다정,, 이거 알려준데로 해도 어케한지 몰라.. 아예 삭제 해버렸어요 좀해주세요 입금자로 표시한 단어로 하라하는데 뭘 눌러야 하나요?,2020년 12월 25일,52,별표 5개 만점에 2개를 받았습니다.
56,물개미,, 모임통장으로 사용중인데.. 이거 기간정해서 확인할수 있는방법이 없잖아요..누가 지금까지 얼마를 냈는지 어플에서 어떻게 확인 합니까..,2021년 1월 1일,51,별표 5개 만점에 1개를 받았습니다.
57,JS Lee,, 타행 모바일뱅킹을 하다보면 카뱅이 얼마나 편하고 빠르고 이용하기 쉬운지 되돌아보게 되네요..,2021년 2월 3일,55,별표 5개 만점에 5개를 받았습니다.
58,fene da,, A50 쓰는데 카드 내역을 보려고 하면 계속 튕겨요;;; 최대한 빠른 시일내에 해결 됐으면 좋겠어요,2021년 1월 1일,51,별표 5개 만점에 1개를 받았습니다.
