,author,developer_reply,review,review_date,reviewer_ratings,star
59,박채은,, 주민등록증 사진 찍을 때 후면 카메라 밖에 못 사용하네요... 후면 카메라 고장 나서 초점 안 맞춰지는데ㅠㅠ 30분 동안 오십견 온 듯 미친듯이 덜덜 거리는 카메라로 찍었는데도 안 되네요 하 전면 카메라는 추가하실 생각이 없으신가요,2020년 12월 16일,53,별표 5개 만점에 3개를 받았습니다.
60,Play Garden,," 카카오연동하고 들어갔는데 계좌가 안 보여. 로그아웃하고 계좌가 있으신가요? 들어갔는데 또 계좌가 안 보여. 새로 만들려니 이미 만든 게 20일 안 지났다고 못 만든대. 지금 당장 계좌는 필요해. 됐어. 안 써. 이걸 왜 쓰니, 대체??",2020년 12월 14일,51,별표 5개 만점에 1개를 받았습니다.
61,내 얼굴 이쁜거아는데 뭘 봐,, 다른거 친구들과 부모님 돈 보낼때 엄청 편리한데 이체 내역 볼려면 계속 튕기네요 지웠다 깔아도 그렇고 폰을 껐다켜도 그렇고 왜 이런거죠,2021년 1월 1일,51,별표 5개 만점에 1개를 받았습니다.
62,Sunghee Lee,, 지문인식으로 로그인하려면 계속 앱이 죽습니다. 얼마전까지만 해도 로그인 해서 잘 쓰고 있었는데 요즘들어 계속 로그인을 못하고 앱이 계속 죽습니다. 빨리좀 고쳐주세요.,2021년 1월 18일,51,별표 5개 만점에 1개를 받았습니다.
63,박준수,, 신분증 촬영을 하는데 제발 진짜 더도말고 터치해서 사진이 찍히면 좋게고 어두운곳에서 촬영하라해서 했더니 그림자가 드리워지지 않게하라하고 밝은데서하면 계속 찍히기는 하는데 다음화면으로 넘어가지지도않네요 이건 뭐 어쩌라는건지 모르겠습니다,2020년 12월 20일,51,별표 5개 만점에 1개를 받았습니다.
64,김소윤,, 잘만든거같아요 이용도편리하고 수수료없이 편의점출금가능한카드는 정말대박탬 카카오 기업이된이유가분병있을듯.!,2020년 12월 25일,55,별표 5개 만점에 5개를 받았습니다.
65,배은혜,, 누구나 쉽게 이체.결제가능하고 후불교통까지도니 정말편하고 좋네요.ㅎ,2021년 1월 31일,55,별표 5개 만점에 5개를 받았습니다.
66,최준영,, 카카오뱅크를 잘 사용하고 있었는데 며칠전부터 내 계좌에 들어갈 때 마다 앱이 강제종료가 됩니다ㅜ 왜이러는걸까요??ㅜ,2021년 1월 3일,54,별표 5개 만점에 4개를 받았습니다.
67,lymos,, 신분증재확인대상 거래제한 ? 제출하신 신분증에 대한 확인이 진행 중입니다 도대체 언제 까지 확인하실건지.... 1040387,2021년 2월 17일,51,별표 5개 만점에 1개를 받았습니다.
68,펀파리,, 은행어플이 이래도 괜찮은가? 몇시간째 로그인도안되고 입금도안된다,2021년 2월 9일,51,별표 5개 만점에 1개를 받았습니다.
69,최석훈,," 계좌개설을 하는 도중에 인증을 해야 하는 상황에서 잘 못 누르는 바람에 주민등록증 인증이 아닌 다른 인증 방법을 선택하게 되었고, 이를 바꾸고자 하는데 인증 방법을 바꾸지를 못합니다. 처음부터 다시 계좌개설을 할 수는 없을까요?",2020년 12월 12일,54,별표 5개 만점에 4개를 받았습니다.
70,개.,, 처음에는 실행이 되는데 돈볼려고 누르거나 이체할려고 누르면 갑자기 꺼져버려요 제 돈은 어떡하나요 ㅜㅜ,2021년 1월 1일,51,별표 5개 만점에 1개를 받았습니다.
71,김토실,, 다 좋은데 요즘 웬만한 1금융권엔 다 있는 모바일 otp가 없는게 아쉽네요.,2021년 1월 27일,54,별표 5개 만점에 4개를 받았습니다.
72,김나영,, 같지만 다른 은행 좋은 캐치프라이즈이긴 한데 ㅋㅋㅋ 다른분이 지적해주셨듯 카카오뱅크 같지만 (사실) 다른은행임 ^^ 이렇게 보여요 ㅠㅋㅋㅋㅋㅋ,2021년 1월 24일,55,별표 5개 만점에 5개를 받았습니다.
73,조혜란,, 정말편리하게 잘사용중입니다. 이체한도도 높고 수수료도 없고 최고엄지척!,2021년 1월 13일,55,별표 5개 만점에 5개를 받았습니다.
74,연緣,, 카카오뱅크에서 얼마남았는지 문자와서 좋고 카카오미니등 다양한 기능있어서 편리합니다.,2021년 1월 4일,55,별표 5개 만점에 5개를 받았습니다.
75,김진기,," 가입절차에서,도로명ㆍ건물번호기입했는데,작동이않돼네요,무슨문제가있나요",2021년 1월 10일,53,별표 5개 만점에 3개를 받았습니다.
76,김영미,, 다좋은대 제가이번에사정이생겨서 명의가다른폰으로교체하는대 휴대폰인증안되면못쓰나여 다른방법이없나여?,2021년 2월 9일,54,별표 5개 만점에 4개를 받았습니다.
77,수현,, 2.4.1 업데이트 노트10+ 는 언제 해주나요? 아이폰은 이미 되던데. 왜 카카오는 매번 아이폰이 우선이죠? 카톡 이모티콘 사건도 그렇고요,2020년 12월 10일,51,별표 5개 만점에 1개를 받았습니다.
78,Frances Lee,, 앱 재설치됐는데 제 주식계좌가 아예 날라갔어요ㅠㅠㅠ 카카오톡으로 연결했는데 없어서 폰인증해보니까 그거도 안뜨는데 어떻게 해야하나요😭,2021년 1월 15일,51,별표 5개 만점에 1개를 받았습니다.
79,김철수,, 아주 편리하고 좋습니다. 기간 검색 기본값을 한달이 아니라 1년으로 해주시면 더 편할거 같아요,2021년 1월 15일,55,별표 5개 만점에 5개를 받았습니다.
80,고구마,, 주민등록증 인식이 안되네요. 겨우 인식해도 유효하지 않은 민증이라고 뜹니다. 계좌 계설 자체가 불가능합니다.,2021년 1월 6일,52,별표 5개 만점에 2개를 받았습니다.
81,JI스타일,, 지금현재 앱 왜이럼 먹통 터치가 되었다안되었다 환장하네 진짜,2021년 2월 9일,51,별표 5개 만점에 1개를 받았습니다.
82,Andrea Poli,, 카카오프렌즈 캐릭터들이 귀엽고 26주 적금 매우 만족합니다 이체랑 잔액확인도 매우 간편하고요,2020년 12월 14일,55,별표 5개 만점에 5개를 받았습니다.
83,옛날동네아재,, 다크모드 적용이 안되네요 그리고 시스템 기본값 자동전환도 안되는군요,2020년 12월 14일,53,별표 5개 만점에 3개를 받았습니다.
84,ALCOFFIN :,, 카카오뱅크랑 페이랑 왜 따로 노는지 모르겠음 뭐는 페이고 뭐는 뱅크고 결재할때마다 막힘,2021년 2월 8일,51,별표 5개 만점에 1개를 받았습니다.
85,hyunchul kim,," 잘 사용되다가 며칠전부터 앱을 실행시키면 안전에 위협이 있다면서 실행이 안되는데 그 이유가 무엇이며, 해결방법을 가르쳐주세요!",2021년 1월 6일,53,별표 5개 만점에 3개를 받았습니다.
86,김수빈,, 아주 잘 사용하고 있어요. 근데 mini에도 세이프박스기능이 있었으면 좋겠어요ㅠ,2021년 1월 14일,54,별표 5개 만점에 4개를 받았습니다.
87,718 J,," 다 좋은데 미성년자는 mini로 적금, 저금통 사용이 안된다는 게 아쉬워요",2020년 12월 30일,54,별표 5개 만점에 4개를 받았습니다.
88,돼지죽통,, 업데이트되고나서 버퍼가 왜 이리심하죠,2021년 2월 2일,53,별표 5개 만점에 3개를 받았습니다.
89,전유빈,, 계좌 내역 확인하려고만 하면 자꾸 튕깁니다 3번을 지웠다가 다시 깔았는데도 계속 그러네요..,2021년 1월 1일,51,별표 5개 만점에 1개를 받았습니다.
90,CB B,, 와 ※발 제가 계속 렉걸려서 핸드폰 전체 초기화해서 카뱅 지우고 다시 깔았거든요 근데 다시 깔수 없뎈ㅋㅋㅋㅋ,2020년 12월 30일,51,별표 5개 만점에 1개를 받았습니다.
91,채혁재,, 다좋은데..왜 앱에는 28000원이있다면서 카드로 결제하면 잔약부족이라 뜨는거에요?,2021년 1월 7일,53,별표 5개 만점에 3개를 받았습니다.
92,Joong Hyeon Park,, 얼른 카뱅으로도 공동인증서 발급이 가능한 날이 오기를...ㅠㅠ,2021년 2월 5일,55,별표 5개 만점에 5개를 받았습니다.
93,채민수,, 농협이랑 콜라보 쳐 하시고 왜 계좌는 연결이 안 되는 걸까요?? 허허 재미있네^^ 계좌가 없다네 ㅋㅋㅋㅋ 통장이 눈 앞에 있는데 ㅋㅋㅋㅋ,2020년 12월 14일,51,별표 5개 만점에 1개를 받았습니다.
94,송세경,, 왜 연결이 안되나요?결제도 안되고,2021년 2월 9일,51,별표 5개 만점에 1개를 받았습니다.
95,나진,, 잘쓰고 있었는디 갑자기 안들어가지는건 무슨 경우인가요? 필요로하는 상황에 안들어가지면 무슨 소용입니까? 삭제했다가 다시 깔아도 튕기는데 하루빨리 개선 쫌 해주세요,2021년 1월 13일,52,별표 5개 만점에 2개를 받았습니다.
96,이광규,, 너무좋아요 최고예요 이런 뱅크가 존재한다는게 너무 행복합니다 감사합니다,2020년 12월 18일,55,별표 5개 만점에 5개를 받았습니다.
97,김상선,, 사용과 신뢰와 편리함 그리고 안전함이 보장!,2021년 1월 30일,55,별표 5개 만점에 5개를 받았습니다.
98,무밍,, 일시적인 오류로 계좌이체가 안되요 좀 고쳐요,2020년 12월 20일,51,별표 5개 만점에 1개를 받았습니다.
99,가니메데스,, 편리하고 유용해서 자주 사용해요.,2021년 2월 12일,55,별표 5개 만점에 5개를 받았습니다.
100,로즈,, 시스템이 간단하고 적은 돈을 저축하기도 좋고 이쁘기까지~♥,2021년 1월 11일,55,별표 5개 만점에 5개를 받았습니다.
101,이성민,, 통신망상태가 정상이 아니라는데 어떻게해야하나용,2021년 1월 27일,54,별표 5개 만점에 4개를 받았습니다.
102,하수민,, 수수료도없고 은행갈필요없고 아주편리해요,2020년 12월 11일,55,별표 5개 만점에 5개를 받았습니다.
103,정길영,, 카카오뱅크 소액대출 신청 했드만 스팸 대출전화 하루에 10통화넘게 오네요 이런건 수정해야되는거 아닌가요,2020년 12월 29일,54,별표 5개 만점에 4개를 받았습니다.
104,익명,, 지문인식로그인 무한 오류 등 앱 안정성이 은행 앱 중 최악,2021년 1월 29일,51,별표 5개 만점에 1개를 받았습니다.
105,엘사은지,, 치사뿡이다. 왜 만14살만 돼? 만13세도 하면 안돼? 이 앱을 13세도 되게 만들었어야지! 부모님이랑 다 계획짠건데 망쳤네 하! 흥!,2021년 2월 18일,51,별표 5개 만점에 1개를 받았습니다.
106,넛코코,, 버퍼가 너무 느린데..,2021년 2월 2일,51,별표 5개 만점에 1개를 받았습니다.
107,보배,, 다 좋은데 말이죠 같지만 다른은행 저것좀 지워줘요 카카오뱅크 같지만 다른은행= 카카오뱅크처럼 보이지만 다른은행 이렇게 받아들여져요 ㅋㅋ,2021년 1월 18일,55,별표 5개 만점에 5개를 받았습니다.
108,정병욱,, 사용하기 편하고 보기도 편하고 좋아요.,2021년 2월 1일,55,별표 5개 만점에 5개를 받았습니다.
109,장지혜,, 이체해야 하는데 1시간동안 버퍼링... 카뱅 문제 생겼나요??,2021년 2월 9일,51,별표 5개 만점에 1개를 받았습니다.
110,진리윤,, 문의전화너무친절하네요!!!!!카드일주일기다리게되네요꼭받고안전히잘쓰겠습니다,2021년 1월 5일,55,별표 5개 만점에 5개를 받았습니다.
111,샤랄랄라ᅡᄅ랄인프피요정,, 수수료도 없고 전 갠적으로 비대면으로 모든 은행업무를 볼수있어서 카뱅만 거의써요,2020년 12월 23일,55,별표 5개 만점에 5개를 받았습니다.
112,Michael Son,, 간편해서 좋고 수수료가없어 더 좋네요,2020년 12월 26일,55,별표 5개 만점에 5개를 받았습니다.
113,클럽매니아,, 최악이다 자기들 멋대로 잘쓰던것도 신분증 재확인 대상이라고 거래제한 둬버린다 음식점에 카드딱하나들고가서 밥먹는데 제한이되버리는데 사람 미쳐버린다,2021년 1월 19일,51,별표 5개 만점에 1개를 받았습니다.
114,짱돌,, 신분증 사진을 찍어는데 계속 오류 뜨네요...,2020년 12월 27일,51,별표 5개 만점에 1개를 받았습니다.
115,환타,, 사정이 있어서 카드 우체통에 넣어달라고 부탁드렸는데 무시하시고 그냥 가버리심...,2020년 12월 7일,51,별표 5개 만점에 1개를 받았습니다.
116,김동희,, 거래 내역 볼려고 할 때마다 튕겨요. 어떻게 좀 해주세요 ;,2021년 1월 2일,51,별표 5개 만점에 1개를 받았습니다.
117,안요안나,, 카뱅으로 소소하게 적금도하고 모으는 재미도 느끼고 편리한 앱입니다,2021년 1월 22일,55,별표 5개 만점에 5개를 받았습니다.
118,이승원,, 신분증으로만 인증할수있게해놓고 제대로 인식을 못합니다. 자꾸이름이 틀렸다고 해서 사용을 할수가없어요,2021년 1월 16일,51,별표 5개 만점에 1개를 받았습니다.
119,정다현,, 업데이트를 하려는데 저장공간이 있음에도 불구하고 안돼요 수정해 주세요,2021년 1월 5일,51,별표 5개 만점에 1개를 받았습니다.
120,hyekeun lee,, 은행앱중 가장쉽고 간결하게 만들어진듯,2021년 2월 1일,55,별표 5개 만점에 5개를 받았습니다.
121,엄마말고내가외계인,, 아니 왜 계좌확인 하려고 누르면 튕기는 거죠 답답해 죽겠네요ㅡㅡ;;,2020년 12월 31일,51,별표 5개 만점에 1개를 받았습니다.
122,바람의검신,, 진짜 편함 수수료도없고...,2020년 12월 23일,55,별표 5개 만점에 5개를 받았습니다.
123,Kihyun Mun,, 처음에 조금 높은 금리로 유인해서 계좌개설시킨 후에 계속해서 금리 낮춤.,2020년 12월 24일,52,별표 5개 만점에 2개를 받았습니다.
124,박진석,, 비대면에 특화되어진 미래지향적 bank.,2021년 2월 4일,54,별표 5개 만점에 4개를 받았습니다.
125,A2as214,, 노트9인데 계좌를 누르면 앱이 튕기네요 이체는 정상적으로 되는데 오픈뱅킹하려고 계좌를 터치하면 앱이 튕겨요,2021년 1월 1일,52,별표 5개 만점에 2개를 받았습니다.
126,무얼사삼,, 모임통장 회비 입금을 다른 은행에서 할 수 있었으면 좋겠네요....,2021년 1월 9일,53,별표 5개 만점에 3개를 받았습니다.
127,김맛,, 카드도 이쁘고 좋고 다좋은데 혹시 예금한도 500000원 조금 적다고 생각되어서 백만원까지 해주시면 안될까요 백만원이 아니더라도 좀만 늘려주세요ㅠㅠ 젭알 ㅠㅠㅠ,2020년 12월 28일,54,별표 5개 만점에 4개를 받았습니다.
128,권세원,, 항상 빠르고 편리하며 정확한 카카오뱅크,2020년 12월 31일,54,별표 5개 만점에 4개를 받았습니다.
129,Sabine Lee,, 우선 카카오뱅크 덕분에 전세자금대출 문제없이 받아서 넘 고맙고 편했어요,2020년 12월 30일,55,별표 5개 만점에 5개를 받았습니다.
130,이원재,, 왜 돈보내려는데 통신망 상태 어쩌고 하면서 안보내지나요?,2021년 1월 28일,55,별표 5개 만점에 5개를 받았습니다.
131,조쿨,, 마이너스 통장 저거 신용카드 안쓰면 허가 안되는거면서 괜히 카카오 계좌개설해서 딴계좌 개설 못하게됐네,2021년 2월 3일,51,별표 5개 만점에 1개를 받았습니다.
132,ㅇㅁㄴ,," 태국 외화송금시 시중은행에 비해 터무니없이 높은 환율이네요. 수수료도 8천원이고 환율차이도 많이나고.. 도대체 환율 기준이 뭐임? 다른 시중은행이랑 비교가 안될정도인데 ""송금 보낼때"" 기준이 아니고 ""현찰 살때"" 기준인가? 큰금액이면 진짜 수십만원씩 차이납니다. 환율 우대는 못해줄망정 오히려 더 비싸지는 말아야죠 그리고 WU빠른송금도 무슨 1억도 아니고 1천만원 송금 한걸가지고 보안이라는 명목으로 거래 정지됐다고 WU 전화번호 딸랑 알려주고 나보고 알아서 인터뷰 심사하래서 전화할랬더니 계속 통화중이라 전화연결도 안되서 하루종일 생쑈...전체 리뷰태국 외화송금시 시중은행에 비해 터무니없이 높은 환율이네요. 수수료도 8천원이고 환율차이도 많이나고.. 도대체 환율 기준이 뭐임? 다른 시중은행이랑 비교가 안될정도인데 ""송금 보낼때"" 기준이 아니고 ""현찰 살때"" 기준인가? 큰금액이면 진짜 수십만원씩 차이납니다. 환율 우대는 못해줄망정 오히려 더 비싸지는 말아야죠 그리고 WU빠른송금도 무슨 1억도 아니고 1천만원 송금 한걸가지고 보안이라는 명목으로 거래 정지됐다고 WU 전화번호 딸랑 알려주고 나보고 알아서 인터뷰 심사하래서 전화할랬더니 계속 통화중이라 전화연결도 안되서 하루종일 생쑈를함. ( 인터뷰 심사는 아주 사적인거까지 물음 1천만 송금하는데 무슨 불법적인 엄청난 죄라도 짓는 느낌임) 그리고 제일 반전인게 WU송금은 ""미화"" 수령이라고 써놓고선 또 태국 현지에선 바트로만 줍니다. WU에서 수령할때 송금 보내는 환율이 아니고 현찰 살때 기준 환율이라 40~50만원 손해 + 스트레스 다시는 카카오 해외송금 안씁니다.",2020년 11월 27일,51,별표 5개 만점에 1개를 받았습니다.
133,김상,," 모임통장용으로 개설하며 쓰고 있습니다. 참가자들이 이력을 함께 볼수 있는 점이 좋았습니다. 다만, 메모기능이 있었으면 좋겠습니다. 예를들어 공금으로 쇼핑몰에서 물건을 구입했을때, 해당 쇼핑몰이름만 확인할수 있을뿐 어떤 목적으로 사용했는지 확인이 어렵습니다. 둘째로 이력을 클릭했을때 상세보기가 있었으면 좋겠습니다. 실수로라도 참가자 본인이름을 누락한채로 입금시 누가 입금했는지 후에 알기가 어렵습니다. 적어도 입금에 관련해서는 누가, 어느 통장에서 입금했는지에 대한 상세 정보가 표출되었으면 좋겠습니다.",2020년 12월 2일,54,별표 5개 만점에 4개를 받았습니다.
134,김영진,, 카카오 미니 카드 짱짱 앞으로도 계속 쓸 수 있게 해주세요,2021년 1월 3일,55,별표 5개 만점에 5개를 받았습니다.
135,김영국,, 촬영조건이 너무 까다로운 것 같아요..,2020년 12월 13일,52,별표 5개 만점에 2개를 받았습니다.
136,탱이곰,, 잘 쓰고있는데요 갑자기 들어가서 카드내역에 윗 부분 (제 mini 부분) 누르면 튕겨요...이거 왜이러는거죠? 정확하게 확인하고싶은데 안되네요...이거 저만 그런게 아닌거 같은디...;;,2021년 1월 2일,54,별표 5개 만점에 4개를 받았습니다.
137,호키,, 이체할때 전액이체도 있었으면 좋겠어요~~,2021년 1월 2일,55,별표 5개 만점에 5개를 받았습니다.
138,¿?ᄋᄉᄋ,, 업데전 어두운배경의 인터페이스 좋았는데 업뎃하고나니까 새하얀배경 고정이네요 다크버전이라던가 없어요?? 카뱅최대장점이 보기좋은 깔끔한인터페이스였는데 어째서 더 구려졌나요; 배경색이라도 좀 바꿀수있게 해주든가,2020년 12월 7일,52,별표 5개 만점에 2개를 받았습니다.
139,개쩌는놈,, 통장쪼개기 기능이 있으면 좋겠습니다~,2021년 1월 15일,54,별표 5개 만점에 4개를 받았습니다.
140,잘못된,, 편하고 다 좋은데 카카오 페이하고 연동 왜 안 되는건지,2021년 1월 24일,55,별표 5개 만점에 5개를 받았습니다.
141,Sound of nature,, 다른은행보다 편하고 좋아요,2020년 12월 23일,55,별표 5개 만점에 5개를 받았습니다.
142,N혜리,, 전달해주는 아저씨를 못만나서 카드를 못받고 있어요.취소하고 싶어요.,2020년 12월 19일,51,별표 5개 만점에 1개를 받았습니다.
143,이진우,, 수수료 무료으로 좋다,2021년 2월 13일,55,별표 5개 만점에 5개를 받았습니다.
144,알맹이,," 원래 여기 계좌가 있는데 다시 사용하려고 깔았는데, 민증이 안된다고 운전면허증을 찍으라는데.... 카카오뱅크의 제 계좌 보려면 면허증을 따야 접근할 수 있는 건가여...ㅠ",2020년 12월 12일,51,별표 5개 만점에 1개를 받았습니다.
145,꽃블라,, 최고~~^^♡ 가계부도 같이 있으면 금상첨화 일듯 하네요,2021년 1월 3일,55,별표 5개 만점에 5개를 받았습니다.
146,하하호호,, 훼손된 민증이라고 출금 자체가 정지되고..고객센터 전화하니까 민증을 새로 발급받을수밖에 없다고하는데..민증발급받는데만 며칠에서 몇주가 걸리는데...그동안은 통장 잔액도 쓰지 못하고 월급 계좌도 다 변경해야하는 불편함이있네요ㅡㅡ 최소한 고객센터로 전화했을때 비밀번호등 본인 인증되면 남은 잔액이라도 출금할수있었으면 좋겠어요 이런 불편함때문에 카카오뱅크는 이제 안쓸거같네요,2021년 1월 12일,51,별표 5개 만점에 1개를 받았습니다.
147,Соня Ким,, 어제부터 카카오뱅크 어플이 오류나면서 접속이 안되고있는데. 이거 해결좀 해주세요!! 어플을 재설치하거나 휴대폰을 재부팅 해도 접속이 안되요!,2020년 12월 3일,51,별표 5개 만점에 1개를 받았습니다.
148,사다부중,, 상대방이 돈을 넣은걸 확인 했는데 돈이 안 들어왔고 입출금 내역 확인하려니까 튕겨요 이거 어떻게 해야하죠?,2021년 1월 1일,51,별표 5개 만점에 1개를 받았습니다.
149,[always SEOYOON]서윤,," 세이프박스 금액 조절하는거 다이얼로 바꿔주시면 더 편할 것 같아요. 스크롤로 미세조정하기 조금 불편해서요. 시간 맞추는 것처럼 다이얼로 바꾸면 훨씬 편리할 것 같아요. 그리고 세이프박스 출금할 때 잔액말고 출금액으로 설정할 수 있으면 좋겠어요. 보통 얼만큼이 필요해서 빼는걸텐데, 얼마 뺄지 잔액을 보고 한 번 더 생각해야해서 불편해요.",2020년 11월 6일,54,별표 5개 만점에 4개를 받았습니다.
150,지효,, 진짜 카드도 너무 귀엽고 돈 관리도 편해서 좋은데 패턴 없앨순없나요 아니면 순서를 비번을 첫번째로하고싶은데 설정에 들어가도 패턴을 안하거나 순서를 바꾸는건 없더라구요😭😭,2020년 11월 26일,54,별표 5개 만점에 4개를 받았습니다.
151,꿈이,, Mini를 누르면 계속 튕기네요,2021년 1월 1일,52,별표 5개 만점에 2개를 받았습니다.
152,김미지,, 상담원도 친절하고 편하고 좋아요,2021년 1월 4일,55,별표 5개 만점에 5개를 받았습니다.
153,정천식,, 이체시 타은행도 수수료도 없이 신속하게 이체하기가 아주 쉽고 편합니다,2021년 2월 11일,55,별표 5개 만점에 5개를 받았습니다.
154,박다연다연,," 너무 잘 쓰고 있습니다 ! 제안할 게 있는데요, 홈화면 금액 표시 옵션을 여러 계좌에 똑같이 적용하는 게 아니라 계좌별로 옵션을 끄고 킬 수 있게 달아주면 훨씬 좋을 것 같습니다 ! 금액을 자주 확인해야 하는 계좌도 있고, 자꾸 신경쓸바엔 차라리 엎어두고 쓰는게 나은 계좌도 있고.. 다 달라서요! 쓰면서 그 점이 바뀌면 정말 좋겠다는 생각을 했습니당! 감사합니당~",2020년 10월 22일,55,별표 5개 만점에 5개를 받았습니다.
155,"ᄋᄏ 조심히들어와, 한 이. 연임을미경",, 편하고 안전해요 26주적금도 재밌네요,2020년 12월 10일,55,별표 5개 만점에 5개를 받았습니다.
156,민근,, 본인인증 매우 거지같음 ㅡㅡ 신분증 하나때문에 갑자기 모든계좌 이용정지를 걸어버리고 (현재 이용계좌 3개) 무조건 재발급받으라고만 하내 ㅋㅋㅋ 개빡친다 ㅎㅎㅎ 고객센터 cs들도 앵무새같이 똑같은말만 대답하고 답답해디지것네,2021년 1월 14일,51,별표 5개 만점에 1개를 받았습니다.
157,라이온킹,, 이거 대출한도 알아보려고 한번 이용하면 전화번호 다털려요 온갖 대출업체에서 매일 전화오고 스팸해놔도 딴번호로 계속와요,2021년 1월 1일,51,별표 5개 만점에 1개를 받았습니다.
158,초심,," 수수료 무료 너무좋아요 이체하고 출금하는 아까운 돈을 아낄수있는건 정말 좋아요많은사람들에게 이 편리한 은생을 알리고 있어요. 불편한건 카카오뱅크, 카카톡 이체, 사람들이 너무 어려워한다는거에요. 다 다르다는것 어디로 돈이 들어가는지 헤깔려한다는거 나이드신분들은 톡으로 받거나 시간네 못받으면 돌아가고 어디로 입금되는지 힘들어 합니다. 함께 공부사용하면 더 큰 카뱅, 톡체 가능할것 같아요.",2020년 10월 27일,55,별표 5개 만점에 5개를 받았습니다.
159,유춘화,, 은행보다 신속 편리합니다,2021년 1월 2일,55,별표 5개 만점에 5개를 받았습니다.
160,오영민,, 은행 어플 중에서 가볍고 사용성 좋음,2021년 1월 31일,55,별표 5개 만점에 5개를 받았습니다.
161,정윤희,, 일단 수수료가 면제라서 좋아요,2021년 2월 8일,55,별표 5개 만점에 5개를 받았습니다.
162,김정현,, 업데이트후 배터리소모가심합니다 각종버그와 폰문젠줄알고 서비스센터가니 어플문제라고하더군요,2020년 12월 6일,51,별표 5개 만점에 1개를 받았습니다.
