,author,developer_reply,review,review_date,reviewer_ratings,star
163,김블리,, 빠져나가지도 않은 후불교통카드 금액을 빠져나간것 마냥 이체기록에 적어놓은거도 어이가 없는데 그걸 확인하려는 고객이 문제인것마냥 진상인마냥 대하는 고객센터직원 정말 불편하네요 이런거 교육안하시나요? 정말 있던 신뢰 다 떨어지네요 좋게 생각하고 있었는데 ㅎ; 돈 빠져나갔던걸로 기억한다 하니까 그럴리가 없다고 고객님이 수긍하지 못하시니 확인해보겠다고하는게 말인가요? 그럼 왜 찍힌거냐 한 번 더 물어보니까 답답하다는듯이 대답하는데 기분이 매우 몹시 나쁘네요 제가 서비스쪽에서 일하고있어서 욕하거나 싸가지없게 말하지도않았어요 앞에 전화한 고객...전체 리뷰빠져나가지도 않은 후불교통카드 금액을 빠져나간것 마냥 이체기록에 적어놓은거도 어이가 없는데 그걸 확인하려는 고객이 문제인것마냥 진상인마냥 대하는 고객센터직원 정말 불편하네요 이런거 교육안하시나요? 정말 있던 신뢰 다 떨어지네요 좋게 생각하고 있었는데 ㅎ; 돈 빠져나갔던걸로 기억한다 하니까 그럴리가 없다고 고객님이 수긍하지 못하시니 확인해보겠다고하는게 말인가요? 그럼 왜 찍힌거냐 한 번 더 물어보니까 답답하다는듯이 대답하는데 기분이 매우 몹시 나쁘네요 제가 서비스쪽에서 일하고있어서 욕하거나 싸가지없게 말하지도않았어요 앞에 전화한 고객이 욕해서 기분 나빠있나 싶지만 그건 내가 아닌데요..^^;;,2020년 10월 12일,51,별표 5개 만점에 1개를 받았습니다.
164,Jin Teddy,"<div class=""LVQB0b""><div class=""QoPmEb""></div><div><span class=""X43Kjb"">KakaoBank Corp.</span><span class=""p2TkOb"">2020년 10월 5일</span></div>안녕하세요. 카카오뱅크입니다. 앱 로그인 후 홈 화면에 표시된 금액이 바로 보이지 않도록 ""화면편집""을 해보실 수 있습니다. 홈 화면 하단에 ""화면편집""을 터치하셔서 ""홈 화면에 금액 표시"" 기능을 이용해보세요. 숨겨진 금액은 금액 표시 부분을 손가락으로 살짝 밀어서 보실 수 있습니다. 감사합니다. 카카오뱅크 드림</div>", 편하고 좋아요! 그런데 잔액(보유금액) 숨기기 기능이 있으면 좋겠어요. 세이프 박스나 계좌 금액이 앱에 들어가면 액정에서 바로 보이니까 타인에게 보이는 게 불편해요.....,2020년 9월 25일,54,별표 5개 만점에 4개를 받았습니다.
165,Kim Ingds,, 현금출금이 다소 불편하고 수수료가 비싸요ㅠㅠ 나머지 기능들은 모두 만족합니딘,2021년 1월 11일,54,별표 5개 만점에 4개를 받았습니다.
166,이기현,, 처음 사용할때는 본인인증 한번하고 그뒤로 비번이나 패턴등으로 간편히 로그인 되서 편히 잘쓰다가 몇번째 업데이트후 인지 모르겠으나 매번 사용할때마다 재인증 요구 해서 귀찮고 짜증남 편하게 쓰려고 사용하는건데 매번 접속시마다 휴대폰인증 신분증인증 받아야 되서 신분증 없으면 사용도 못함 있던돈 다빼고 앱이 별로라서 이제 안씀 처음만 편했던 카뱅 지금은 안씀 업데이트좀 잘해라,2020년 11월 6일,51,별표 5개 만점에 1개를 받았습니다.
167,지나가는콘_,," 카카오뱅크 mini 정말 잘쓰고있는데요, mini 계좌도 세이프박스 기능 쓸 수 있게 해주시면 두 좋을 것 같아요. 이미 mini계좌가 있는데 세이프박스를 만드려고 하면 입출금통장을 만들라고 하고 입출금통장을 만드려고 주민등록번호를 입력하면 mini계좌를 만들라고 나와서요..",2020년 11월 18일,54,별표 5개 만점에 4개를 받았습니다.
168,신진아,," 아침에 결제를 해서 잔돈이 더 생기는 경우가 있는데 항상 전날 특정 시간대의 잔돈이 저금통에 들어가더라고요 저는 뒷자리가 0으로 딱 떨어지는 걸 좋아해서 저금통 한건데 아침 결제 후 남은 잔돈까지 저금통에 안 들어가는게 좀 아쉽습니당,, 저금되는 시간이 정해져있는 것 같은데 그 전까지의 모든 잔돈이 저금되면 좋겠어용 ㅎ",2020년 11월 2일,54,별표 5개 만점에 4개를 받았습니다.
169,문태완,, 모임통장을 생활비 계좌로도 사용하는데 아이들 경제 교육을 위해 어린 자녀들이 같이 보면 좋겠습니다. 모임 회원이라도 먼저 풀어주세요. 잠재고객 아니겠습니까?,2020년 10월 23일,55,별표 5개 만점에 5개를 받았습니다.
170,Jae Ho Lee,, 편리하고 유용함,2021년 1월 5일,54,별표 5개 만점에 4개를 받았습니다.
171,뭐있냐인생,, 카뱅 미니카드 체크카드랑 교통카드 둘 다 사용 가능한건 좋은데 교통카드로 사용할려면 편의점 등에 가서 따로 충전해야 한다는게 불편하네요ㅠㅠㅠ 그냥 일반 체크카드처럼 한번에 같이 적용되는거면 더 좋을거 같아요,2020년 10월 22일,54,별표 5개 만점에 4개를 받았습니다.
172,조재오,, 아 간편번호 재설정 하려는데 왜 이체가 안되냐고 장난 하냐? 금융이 장난이야? 걍 메신저 놀이나 해,2020년 12월 4일,51,별표 5개 만점에 1개를 받았습니다.
173,sujin um,, 태클 라스트 p80x 기기호환좀 해주세요..지발~~,2021년 1월 13일,55,별표 5개 만점에 5개를 받았습니다.
174,dreamy violet,, 잘 쓰고 있는데 이제 체크카드 디자인도 새로 업뎃해주세요ㅠㅠㅠㅠ mini 너무 예쁜데 그냥 체크카드도 디자인 제발ㅠㅠㅠㅠ 지금 색상 촌스러웠는데 미니처럼 살짝 톤다운된 파스텔 색상이면 좋겠어요 같은 색상에 캐릭터만 바뀌어도 되니까 제발요 너무 오래 됐어요,2020년 10월 27일,54,별표 5개 만점에 4개를 받았습니다.
175,김혜미,, 실명 인증이 안되네요.. 5회중 4회 실패해서 1회 남았습니다. 다른 앱에서는 다 됐는데 여기서만 안되는 게 이상하네요 아무리 확인해도 이름과 주민번호는 틀리지 않았는데.,2020년 10월 5일,53,별표 5개 만점에 3개를 받았습니다.
176,천사소녀홍만,, 아직까지 큰 불편함이 없어서 만족합니다,2020년 12월 22일,55,별표 5개 만점에 5개를 받았습니다.
177,김주영,, 그냥 가지고 있다는 것만으로도 든든해요,2021년 2월 2일,55,별표 5개 만점에 5개를 받았습니다.
178,Lu류난,," 카메라가 안돼면 못쓰는 앱이네요. 다른 인증 방법도 없고, 신분증 자동 촬영인데, 가까이있는거 초점 잘 못맞추는 현휴대폰 상태 때문에 못쓰고 있어요. 수동으로 촬영하라하면 가능한데, 그것도 안돼고 무조건 자동. 거지같네요. 정말. 다른 인증 방법이라도 있어야 하지 않나요.",2020년 10월 10일,51,별표 5개 만점에 1개를 받았습니다.
179,왕룡장,, 이체하기도 편하고 또 수수료도 없으니 너무 좋은것 같아요 그리고 대출 하기도 가편하고 좋어요~~^^,2020년 12월 13일,55,별표 5개 만점에 5개를 받았습니다.
180,Kyungs,, 편하게 잘 사용하고 있습니다. 계좌별로 잔액표시를 선택하면 더 좋겠습니다. 현재 앱 버전에서는 여러 계좌에 공통으로 잔액표시 여부를 선택할 수 있어요.,2020년 10월 21일,55,별표 5개 만점에 5개를 받았습니다.
181,착한버섯_,, 홈화면 계좌별 금액 공개 기능 그리고세이프박스 접기 기능도...추가되면 좋겠네요 통장잔고는 괜찮은데 세이프박스 금액이 신경 쓰여서요,2020년 11월 7일,55,별표 5개 만점에 5개를 받았습니다.
182,김재룡,, 지금 앱실행 안돼고있는데 문제 해결바랍니다,2021년 1월 1일,51,별표 5개 만점에 1개를 받았습니다.
183,신인철,, 너무나 편리하고 신속한 처리가 항상고맙고 감사하게 생각합니다 계속발전 있으기바랍니다,2020년 11월 27일,55,별표 5개 만점에 5개를 받았습니다.
184,바공이,, 정말 좋습니다 좋은데 배경화면 색이 남색으로 바뀐뒤 다시 바뀌지 않습니다 하얀색이 편했는데 남색이 되어버려서 좀 불편하네요 바꾸는법도 나와있지 않구요,2020년 11월 10일,54,별표 5개 만점에 4개를 받았습니다.
185,김James,, 사용하면 알려주는 서비스 안전에 만족함,2020년 12월 10일,55,별표 5개 만점에 5개를 받았습니다.
186,헤이?,," 카드 배송이 안된다고 문의 드렸는데 친절히 답해주시고 바로 수용해주시는게 정말 좋았던 것 같습니다. 또 처음 써보는 앱임에도 불구하고 간단하게 입금,결재 할 수 있는게 나이가 되신다면 써보기 좋을 것 같아요!",2020년 11월 6일,55,별표 5개 만점에 5개를 받았습니다.
187,왈냥,, 폰바꾸면서 깔아가지고 비번기억안나가지고 바꿀려했는데 영통민증사진찍어제출하니 유효안된다하네요....;; 또 계좌이체하라해서 272원보낼려하니 또안됨....,2020년 10월 11일,51,별표 5개 만점에 1개를 받았습니다.
188,_하나링,, 인출할때 자꾸 오류나는데 짜증나요 ㅠㅠ 전화해도 같은 답변뿐이고 하라는대로 다해봤는데 안되서 재설치중입니다...,2020년 10월 26일,51,별표 5개 만점에 1개를 받았습니다.
189,Hz 100,, 계좌 찾으려하니깐 신분증 촬영 인식하라해서 했는데 계속 재촬영하라그러고 이번엔 신분증이 맞지 않다고 통보를 해버리네요 촬영해서 정보 기입하게 하는 시스템을 없애버리던가 수기로 기입하게 해주세요,2020년 11월 8일,51,별표 5개 만점에 1개를 받았습니다.
190,콩나물,, 세이브통장에 메모 기능 넣어주세요 가끔 용도가 있는 돈을 잠시 넣어놓는 경우가 있는데 2-3가지가 되면 따로 메모해야해서 번거롭습니다 ㅎㅎ 메모기능 넣어주시면 감사하겠습니다~,2020년 10월 8일,55,별표 5개 만점에 5개를 받았습니다.
191,김민성,, 반복입금좀 할수있게 해줘요 같은분에게 입금했으니 정보 재확인하라던데 확인해도 그대로고 이게 뭡니까,2020년 11월 28일,51,별표 5개 만점에 1개를 받았습니다.
192,여빛,, 푸시 알림 뭔 짓거리 해도 안뜸,2021년 2월 16일,51,별표 5개 만점에 1개를 받았습니다.
193,스노우볼,"<div class=""LVQB0b""><div class=""QoPmEb""></div><div><span class=""X43Kjb"">KakaoBank Corp.</span><span class=""p2TkOb"">2020년 11월 26일</span></div>안녕하세요. 카카오뱅크입니다. mini 카드의 교통기능은 선불 티머니를 이용합니다. 가까운 티머니 충전 제휴처에서는 현금을 통해, CU에서는 현금과 mini카드 결제를 통해 충전할 수 있습니다. 잔액 및 이용내역 조회, 충전방법 등은 티머니 고객센터(1644-0088)에서 확인 가능합니다. 감사합니다. 카카오뱅크 드림</div>", 미니 카드 교통카드 기능아예 안됩니다 이게 뭐죠? 분명히 교통카드 된다고 나왔는데 0원으로 뜨면서 잔액이 부족하다고 뜨네요,2020년 11월 7일,51,별표 5개 만점에 1개를 받았습니다.
194,noterr,, 오랜만에 다시 하려하니 무슨 인증만 여러번 하고 이제좀 되나 싶더니 계좌로 이체해서 인증하는거 솔직히 말해서 금액을 좀더 낮춰주던가 한번 취소했다고 100원에서 244원은 조금 너무한거 아닌가요 통장에 잔고가 없으면 더더욱 불편한데다 영통도 못하는상황이 있을거 아니에요 인증번호만 계속받고 포기한채로 앱 지웠네요,2020년 10월 7일,51,별표 5개 만점에 1개를 받았습니다.
195,강재원,, 카카오뱅크 어플이 좋아요 솔직히 후기달면 오류이체보낼때 오류가생겼어요 앞으로도 이런일 안생기게 해주세요 부탁드리겠습니다 ~~~ 카카오뱅크 영상통화할때 전화좀빨리해주세요 왜이렇게 전화가안옵니까 서비스 완전히엉망이네요!!!!!,2020년 10월 13일,55,별표 5개 만점에 5개를 받았습니다.
196,17살모배 프로지망생,, 다 좋은데 mini카드를 10월25일일요일에 신청했는데요 mini카드 신청이 접수되였습니다 라고 뜨고 아직도 카드신청이라고 뜨는데 언제 배송하는지 알려주세요,2020년 10월 27일,55,별표 5개 만점에 5개를 받았습니다.
197,fish no,, 전이게 왜이리 평점이 높은지 모르겠어요 신분증촬영만 엄청하고 잘되지도않고 인증은 어려워서 패턴에다가 카드비밀번호에다가 또 그것도모잘라 자체인증번호 그리고 내계좌로 소액입금까지해야되는데 번거로움 갑이네요 인터넷뱅킹 카카오만사용하는데 무슨수로 국민은행으로 입금해야되죠? 씨디기가 백원단위도 입금되나요? 아니면 은행원한테가서 651원입금해달라 할까요 그것도아니면 자주쓰는 국민은행 없던 인터넷뱅킹을 만들까요?,2020년 11월 2일,51,별표 5개 만점에 1개를 받았습니다.
198,빼꼼,, 카뱅 너무 좋아서 계좌 옮기ㅗㄱ 계속 사용하고 있는데 오류 횟수가 한달에 한번에서 점점 더 자주 생기네요 이체 할때 오류 생겨서 난감할때도 있네요 앱삭제후 다시 실행시 오류 사라지는데 빨리 고쳐주면 좁겠어요,2020년 10월 19일,54,별표 5개 만점에 4개를 받았습니다.
199,이승헌,, 로그아웃이 안됨;; 진짜 말도 안된다,2021년 2월 17일,51,별표 5개 만점에 1개를 받았습니다.
