,author,developer_reply,review,review_date,reviewer_ratings,star
132,Mo Elm,," Has lot of technical bugs issues, often reported and rarely taken care of. Also the moderates are less cultural about fine art paintings. They look at them as pictures not as well regarded around the world in the iconic art museums such musèe d'Orsay or du Louvre which freely showing to the public a...Full ReviewHas lot of technical bugs issues, often reported and rarely taken care of. Also the moderates are less cultural about fine art paintings. They look at them as pictures not as well regarded around the world in the iconic art museums such musèe d'Orsay or du Louvre which freely showing to the public and community in general including young students.","February 21, 2021",110,Rated 2 stars out of five stars
133,Lex Stephenson,," I would give this 5 stars but recently the app has been absolutely draining my phone's battery. I have a a Motorola One Hyper and the battery can usually last over 24 hours, but recently I noticed com.facebook.katana has been massively draining my phone in the background and there's no way to reduce...Full ReviewI would give this 5 stars but recently the app has been absolutely draining my phone's battery. I have a a Motorola One Hyper and the battery can usually last over 24 hours, but recently I noticed com.facebook.katana has been massively draining my phone in the background and there's no way to reduce it without uninstalling the entire app. I do a lot of work through Facebook so I need to use the full version of the app, but this issue is very noticeable.","February 8, 2021",192,Rated 2 stars out of five stars
134,Steiner von Wolfkin Kreave,," Blatant censorship in that you get auto banned for a period of time by a bot and God help you if you appeal. Misinforming junk ads. Censorship over-reach that completely defeats the purpose of having closed/private groups. Complete disregard for users when it comes to policy enforcement, if you appe...Full ReviewBlatant censorship in that you get auto banned for a period of time by a bot and God help you if you appeal. Misinforming junk ads. Censorship over-reach that completely defeats the purpose of having closed/private groups. Complete disregard for users when it comes to policy enforcement, if you appeal, you will go from a 7 day ban to a 30 day ban with no explanation. Would give a zero out of five star rating if possible. Non-existent if not outright dismissive customer service.","February 4, 2021",60,Rated 1 stars out of five stars
135,MIH Editing,," After new update I'm not able to login. everytime I try to login it says "" [100] (#100) Param sso_source_to_userid['com.facebook.instagram'] must be number"" I'm just sick of it .Even though my password is right .I can login from browsers like chrome but I'm unable to login from Facebook .Please fix ...Full ReviewAfter new update I'm not able to login. everytime I try to login it says "" [100] (#100) Param sso_source_to_userid['com.facebook.instagram'] must be number"" I'm just sick of it .Even though my password is right .I can login from browsers like chrome but I'm unable to login from Facebook .Please fix this issue .I'm so tired of it.","February 4, 2021",258,Rated 1 stars out of five stars
136,CJ Eltson,," Been using Facebook long time. I love it. Allows me to keep in touch with long distance friends, and helps me stay a part of the Brony fandom. But there are bugs. Nothing major however. For example reacting to stuff. Sometimes the pop-up bar no pop up. Or I can't go through my images.","January 30, 2021",174,Rated 4 stars out of five stars
137,Daniel Colón,," I use this daily, but since i updated the app 2 days ago. I havent been able to access any Friends, Photos, or life events on any of my friends pages. The button is there, but i click on them and nothing happens at all.","February 22, 2021",13,Rated 3 stars out of five stars
138,Benjamin Hayward,," Facebook support. Anyone whose had to deal with it need not read more than that. My account got hacked and subsequently I've been locked out of my account for over a month ""waiting on verification"" I'm sure will never come. I've tried all the ""solutions"" they've provided on their help and support pa...Full ReviewFacebook support. Anyone whose had to deal with it need not read more than that. My account got hacked and subsequently I've been locked out of my account for over a month ""waiting on verification"" I'm sure will never come. I've tried all the ""solutions"" they've provided on their help and support page and none of which are even remotely helpful, not exactly what I'd expect from such a large company. Unimpressed and annoyed that so much uses Facebook that I can't simply remove it from my life.","February 18, 2021",54,Rated 1 stars out of five stars
139,Ursula Fields,," Updates are causing issues and need to be fixed!! After last update This app has gone totally to trash! I can't see post all the way and I have to refresh to see a post, notifications are showing up hours or days later from friends, the emoji issue still hasn't been fixed! Don't update until the iss...Full ReviewUpdates are causing issues and need to be fixed!! After last update This app has gone totally to trash! I can't see post all the way and I have to refresh to see a post, notifications are showing up hours or days later from friends, the emoji issue still hasn't been fixed! Don't update until the issues have been fixed😡😡😡😡","February 16, 2021",12,Rated 1 stars out of five stars
140,Italia Edwards,, I do not like the fact that the messenger app shows a preview of my messages while I am in the Facebook app. I feel like it is the issue with privacy. If I wanted my messages to be known then I will set my notification for the full message to show. I think this is something that you should take into...Full ReviewI do not like the fact that the messenger app shows a preview of my messages while I am in the Facebook app. I feel like it is the issue with privacy. If I wanted my messages to be known then I will set my notification for the full message to show. I think this is something that you should take into consideration of people that care about their privacy nor is it something that is needed on the Facebook app when we already have a separate app which is Messenger to see all Facebook messages! Yes,"February 16, 2021",58,Rated 1 stars out of five stars
141,Hannah Cartmell,, I'm not sure when the last update was but the app keeps closing when I'm scrolling though my news feed or when I switch to my business account. This is very irritating and hinders the use of the app. This hasn't happened to me before. Maybe a new update should be released to correct the bugs in the ...Full ReviewI'm not sure when the last update was but the app keeps closing when I'm scrolling though my news feed or when I switch to my business account. This is very irritating and hinders the use of the app. This hasn't happened to me before. Maybe a new update should be released to correct the bugs in the app.,"February 7, 2021",200,Rated 1 stars out of five stars
142,sheila shoulders,," It was all good until the latest update. Now almost every time I click on a notification, even when I'm mentioned in the comment, it says an unknown error occurred and I cant even see it. Even when I comment on someone's post, it says an unknown error occurred. Someone needs to fix this!!","February 20, 2021",278,Rated 2 stars out of five stars
143,Pritha Chanda,," I would like to request for a new feature for creating separating friendlist into groups and assign the group and customize which all things they can view in a profile. Since among all my friends, i may not want everyone to view all my posts. This feature works when someone is not in my friendlist. ...Full ReviewI would like to request for a new feature for creating separating friendlist into groups and assign the group and customize which all things they can view in a profile. Since among all my friends, i may not want everyone to view all my posts. This feature works when someone is not in my friendlist. Once a person is a friend, then he/she can view everything like all friends.","February 8, 2021",324,Rated 5 stars out of five stars
144,C T,," Stop turning on notifications automatically .....5/1 ...12/17 can't set settings app keeps stopping and report app doesn't work either. 1/4...every time I check something other than what I'm watching the whole thing resets back to main page, I hate it. Restricted but using my data in the background....Full ReviewStop turning on notifications automatically .....5/1 ...12/17 can't set settings app keeps stopping and report app doesn't work either. 1/4...every time I check something other than what I'm watching the whole thing resets back to main page, I hate it. Restricted but using my data in the background. I was reading a post and the app shut down, can't find it now😡","January 31, 2021",72,Rated 3 stars out of five stars
145,Rojo Reyes,, So many bugs. When i view videos on news feed i can't pause or fast forward/back the video. All you can do is finish the video or swipe back. And when i view profile through messenger to Facebook its not properly displayed. And notifications are always delayed. And please bring the true dark/black m...Full ReviewSo many bugs. When i view videos on news feed i can't pause or fast forward/back the video. All you can do is finish the video or swipe back. And when i view profile through messenger to Facebook its not properly displayed. And notifications are always delayed. And please bring the true dark/black mode to fb just like in messenger.,"February 1, 2021",82,Rated 2 stars out of five stars
146,Eisha tir Razia,," It's a very good app, but I've updated it several times and it's still the exact same thing. I really want to create my Facebook avatar but I can't seem to get that option anywhere, very strange⁉️🤔 But overall it is an amazing way to connect with family and friends! And much, much more!!🙂","February 21, 2021",144,Rated 4 stars out of five stars
147,lalo casanova,," In FB marketplace, the saved filters feature doesnt work. I save a filter with multiple parameters for vehicle listings, but when I go to use the filter, it only applies one of the parameters.. Very annoying if you're looking for a certain car..","February 24, 2021",6,Rated 2 stars out of five stars
148,Kelly Schachter,," With the new update, when I try to open pictures (such as memes) to see all of the image, I'm being taken to some weird ""similar posts"" intermediary page before I have to click the image AGAIN to see what was cut off. I don't want to have to hit it twice, I don't want to go to ""similar posts,"" I jus...Full ReviewWith the new update, when I try to open pictures (such as memes) to see all of the image, I'm being taken to some weird ""similar posts"" intermediary page before I have to click the image AGAIN to see what was cut off. I don't want to have to hit it twice, I don't want to go to ""similar posts,"" I just want to be able to see the bottom of the memes that get cut off. Please reverse this change, or at least make it an option that can be turned off.","February 20, 2021",106,Rated 1 stars out of five stars
149,Dc Knudstrup,, A recent update locked me out of my primary account paired with my work's charity page. Resources provided by Facebook to resolve this (Trusted Contacts emails and one time security codes) do not work in the web version on PC or here on the Google play store app version. I have not had access to my ...Full ReviewA recent update locked me out of my primary account paired with my work's charity page. Resources provided by Facebook to resolve this (Trusted Contacts emails and one time security codes) do not work in the web version on PC or here on the Google play store app version. I have not had access to my account with 10+ years of my personal data since December '19. Some form of Facebook rep needs to step in. I feel like this is some small technical snafu that a human could resolve =),"February 14, 2021",103,Rated 1 stars out of five stars
150,Chanratana HORT,," The update seem to have too many bugs, I saw notification on my lock screen, I pressed on it and it take me to the whole comment section where I need to scroll to find my comment or reply or so on and so forth. And just now the videos won't play even if I pressed on the play button, the photos got s...Full ReviewThe update seem to have too many bugs, I saw notification on my lock screen, I pressed on it and it take me to the whole comment section where I need to scroll to find my comment or reply or so on and so forth. And just now the videos won't play even if I pressed on the play button, the photos got stuck. Please fix those bugs","February 5, 2021",116,Rated 1 stars out of five stars
151,Jasper Farinas,," The app is great but under low signal conditions, it becomes slow. Also please bring back the old layout where the friend requests is separate from the notifications. Notifications tab looks cluttered now because of it, and it hides a lot of post interaction notifications. please consider that in th...Full ReviewThe app is great but under low signal conditions, it becomes slow. Also please bring back the old layout where the friend requests is separate from the notifications. Notifications tab looks cluttered now because of it, and it hides a lot of post interaction notifications. please consider that in the next update.","February 6, 2021",96,Rated 2 stars out of five stars
152,Kate BL,," So many bugs all of a sudden in the phone app. Notifications are missing, comments are missing, error messages galore. I have to view Facebook on different devices to see things that are missing from my phone app (I'll get a notification of a comment, it's not there on my phone's app, but I can see ...Full ReviewSo many bugs all of a sudden in the phone app. Notifications are missing, comments are missing, error messages galore. I have to view Facebook on different devices to see things that are missing from my phone app (I'll get a notification of a comment, it's not there on my phone's app, but I can see it on my phone's browser).","February 20, 2021",86,Rated 1 stars out of five stars
153,Thilara Silva,," When I posted a video for the first time, it didn't appear on my timeline. Some friends had commented on the video but still I can't find the video I posted. The same thing happened more than one time previously and I had to post the same thing again and again, till it appears on the timeline. And a...Full ReviewWhen I posted a video for the first time, it didn't appear on my timeline. Some friends had commented on the video but still I can't find the video I posted. The same thing happened more than one time previously and I had to post the same thing again and again, till it appears on the timeline. And also the app keeps stucking and not working everytime.","February 9, 2021",64,Rated 1 stars out of five stars
154,Allen Scott,," I'd give it zero stars if possible! I tried selling on the market section which I had already sold successful before with no issues. Everytime I put the post for the new listing it says it's against guidelines which is impossible I have an item listed with the receipt, original packaging, and tags. ...Full ReviewI'd give it zero stars if possible! I tried selling on the market section which I had already sold successful before with no issues. Everytime I put the post for the new listing it says it's against guidelines which is impossible I have an item listed with the receipt, original packaging, and tags. Very frustrating the when I ask for a review it's denied and the cycle continues due to the dumb AI that's deems items good for sale.","February 16, 2021",182,Rated 1 stars out of five stars
155,Stainless DMC,," Functionality keeps getting worse. Friends' pages won't fully load, I can't see posts that I've been tagged in to review them before accepting them, and I'm constantly getting notifications over and over for posts I've already seen. It's very annoying seeing that little number pop up indicating I ha...Full ReviewFunctionality keeps getting worse. Friends' pages won't fully load, I can't see posts that I've been tagged in to review them before accepting them, and I'm constantly getting notifications over and over for posts I've already seen. It's very annoying seeing that little number pop up indicating I have new notifications when it's actually the same ones I've seen AND read. I'm also so sick of reading an article and having Facebook force-close it on me. Please fix these issues!","February 19, 2021",45,Rated 2 stars out of five stars
156,Hazel Fidellia Richard,," Its been a month i did not received a notifications from facebook. I've been restarted my phone, uninstall the apps, install it back and still, i didnt received any of it. I thought my phone had a problems that i can received any notifications. But it went smoothly when i got a notifications from IG...Full ReviewIts been a month i did not received a notifications from facebook. I've been restarted my phone, uninstall the apps, install it back and still, i didnt received any of it. I thought my phone had a problems that i can received any notifications. But it went smoothly when i got a notifications from IG. Please fixed the apps for goodness sake!","February 11, 2021",244,Rated 1 stars out of five stars
157,Peter O'Connor,," Horrible. Every version gets worse than the one before. Not only do they neglect to actually fix the ongoing technical issues and annoyances, but instead they just shamelessly cram more and more ads down your throat. It's more junk and distractions than anything else now.","February 7, 2021",94,Rated 1 stars out of five stars
158,mohamad aboualjoud,," I think Facebook is good but need some improvements like having a feature like ask.fm (""Ask"" application) asking questions while being anonymous to other guys and girls in the community (who get showed in ""ask list"") and also we miss Facebook games, like you should improve your games, when on comput...Full ReviewI think Facebook is good but need some improvements like having a feature like ask.fm (""Ask"" application) asking questions while being anonymous to other guys and girls in the community (who get showed in ""ask list"") and also we miss Facebook games, like you should improve your games, when on computer in 2008,before cell phones were created, Facebook and too many very entertaining games like Farmville, galaxy life, crazy taxi... Now they are all gone... Please improve Facebook gaming more","January 31, 2021",105,Rated 4 stars out of five stars
159,Ahmed Osman,," Ads just make the video screen black. The main video sound continue playing while the ad doesn't work. On clickin on the video, it opens an ad video in a full page. If you click back or X button in the ad, it doesn't cancel the ad and starts the main video from the beginning. If you watch the ad in ...Full ReviewAds just make the video screen black. The main video sound continue playing while the ad doesn't work. On clickin on the video, it opens an ad video in a full page. If you click back or X button in the ad, it doesn't cancel the ad and starts the main video from the beginning. If you watch the ad in the full page till the end, it doesn't stop automatically, it keeps looping from the beginning again. At the end, i can not watch any videoe because of the ads experience.","January 31, 2021",109,Rated 1 stars out of five stars
160,Hj Hasan,," The reason Why I gave it to 1 star cause I'm Just forgot my password when I'm going recover it with my same smartphone it shows that no account match that information, When I have My email address and also my mobile number but I can't fix it.And it also doesn't show with my user name or full name wh...Full ReviewThe reason Why I gave it to 1 star cause I'm Just forgot my password when I'm going recover it with my same smartphone it shows that no account match that information, When I have My email address and also my mobile number but I can't fix it.And it also doesn't show with my user name or full name what gonna do Facebook with lot of this security when I can't fix my account and the funny thing is I have Everything but I can't fix cause they have lot of this dump security.I want My fb Account.","February 18, 2021",6,Rated 1 stars out of five stars
161,Rohan Vartak,," Whenever I get a notification and I click on it some weird web view appears instead of opening the notification on the Facebook app, also the notification goes away and I can't figure out what was it. I have to close it from recents and then open Facebook app again and then go to notifications secti...Full ReviewWhenever I get a notification and I click on it some weird web view appears instead of opening the notification on the Facebook app, also the notification goes away and I can't figure out what was it. I have to close it from recents and then open Facebook app again and then go to notifications section to find it! Please fix it's been a long time this bug has been bothering me!","February 6, 2021",260,Rated 1 stars out of five stars
162,Mohd Izz Hanif Zulkifli,," Stupid app, dont waste your time by downloading it. I cant login to my account after it suddenly logged out by itself then i cant even login back? What's wrong with that? I even try changing my password to login to my account multiple times but still nothing works. I logged in my games account here ...Full ReviewStupid app, dont waste your time by downloading it. I cant login to my account after it suddenly logged out by itself then i cant even login back? What's wrong with that? I even try changing my password to login to my account multiple times but still nothing works. I logged in my games account here then when this stupid problems happened, i lost all the progress in my games.. this really pissed me off!","February 17, 2021",21,Rated 1 stars out of five stars
163,Benjamin morgan,," Update!!! Still a really really really poor app. This is what it would be like if Apple or epic or EA games took on the social media genre, all round absolute trash, adds,misinformation,one widened stories.... but really the general public should have known to abandon this app once the politicians g...Full ReviewUpdate!!! Still a really really really poor app. This is what it would be like if Apple or epic or EA games took on the social media genre, all round absolute trash, adds,misinformation,one widened stories.... but really the general public should have known to abandon this app once the politicians got onto it.... again trash made by companies to make profits","February 12, 2021",262,Rated 1 stars out of five stars
164,PRS,," I lost access to my account and when I try to reset my password it says the phone number doesn't belongs to the account . I have logged into other platforms through facebook and this has took me in a major problem now. they don't even provide a customer care contact number and take me to a stupid li...Full ReviewI lost access to my account and when I try to reset my password it says the phone number doesn't belongs to the account . I have logged into other platforms through facebook and this has took me in a major problem now. they don't even provide a customer care contact number and take me to a stupid link which is of no use .. I'm not getting the OTP when I say forgot password. why Facebook is becoming worst day by day?. I need a fast action on my query , i need my account back . Help!","February 4, 2021",109,Rated 1 stars out of five stars
165,Wiljaynia May Dela cruz,, Facebook is good at first but then so lot of fake accounts. I always notice that some of using facebook are fake. Please fix this. You have so many rules on Facebook but some are useless. Please detect someone if they are REAL or FAKE. And they are scam too. Don't let fake account to use facebook. I...Full ReviewFacebook is good at first but then so lot of fake accounts. I always notice that some of using facebook are fake. Please fix this. You have so many rules on Facebook but some are useless. Please detect someone if they are REAL or FAKE. And they are scam too. Don't let fake account to use facebook. I hope you will notice this. I am just concern. I don't want anyone will be fool a fake accounts.,"February 20, 2021",14,Rated 2 stars out of five stars
166,Kerri S,, Please for the love of god can you stop changing things?! The new way of seeing comments on groups etc on your newsfeed is horrible! Also if you could make the algorithm better and not punish small businesses for not having the money to pump into your ads that would be great! The reach on business p...Full ReviewPlease for the love of god can you stop changing things?! The new way of seeing comments on groups etc on your newsfeed is horrible! Also if you could make the algorithm better and not punish small businesses for not having the money to pump into your ads that would be great! The reach on business pages is horrendous nowadays!,"February 6, 2021",145,Rated 1 stars out of five stars
167,Catherine Fearnley,, Since the new update I have not been able to access my four pages. When I click on the links the app just shuts down. I have been locked out of groups because I removed myself from 3. It's ridiculous. I have appealed and also sent Facebook info but have received no reply. Pull your socks up Facebook...Full ReviewSince the new update I have not been able to access my four pages. When I click on the links the app just shuts down. I have been locked out of groups because I removed myself from 3. It's ridiculous. I have appealed and also sent Facebook info but have received no reply. Pull your socks up Facebook and get this app fixed otherwise am looking elsewhere.,"February 4, 2021",890,Rated 2 stars out of five stars
