,author,developer_reply,review,review_date,reviewer_ratings,star
0,Shelyna Emerald,," For the most part it's a great app. But it gets so dang annoying that I get 1000's of notifications saying, ""We noticed an unusual login from a device or location you normally don't use. Please review."" I use two devices. My bf uses/has used the same two devices. We logged in and out of our fb accou...Full ReviewFor the most part it's a great app. But it gets so dang annoying that I get 1000's of notifications saying, ""We noticed an unusual login from a device or location you normally don't use. Please review."" I use two devices. My bf uses/has used the same two devices. We logged in and out of our fb accounts on each others phones. I told fb this many times. I even asked them to stop harassing me and please fix this bug but it has been non stop for months. Getting really annoying!","February 24, 2021",1437,Rated 3 stars out of five stars
1,Ashley Krall,," I used Facebook a lot. I also liked to use marketplace. I like to support local community members, but since the recent update my entire marketplace feed it ships to you. If you're not searching for something specific, there's no way to filter for local pickup only. Facebook please fix this. It's an...Full ReviewI used Facebook a lot. I also liked to use marketplace. I like to support local community members, but since the recent update my entire marketplace feed it ships to you. If you're not searching for something specific, there's no way to filter for local pickup only. Facebook please fix this. It's annoying.","February 20, 2021",169,Rated 3 stars out of five stars
2,Ashton Trobridge,," Filter options on marketplace while using a mobile device are very limited I can only choose wether I want to look at a truck, car, motorcycle, etc. No filters that im able to access on a mobile device are available for mileage, year's, condition, etc. Marketplace on a computer compared to a cell ph...Full ReviewFilter options on marketplace while using a mobile device are very limited I can only choose wether I want to look at a truck, car, motorcycle, etc. No filters that im able to access on a mobile device are available for mileage, year's, condition, etc. Marketplace on a computer compared to a cell phone is a day and night difference. Please just make marketplace exactly how it is on the computer.","February 24, 2021",128,Rated 1 stars out of five stars
3,Maria Isabel Ibaseta,," So recently my Facebook suddenly changed from featuring individual photos to 'Collections' and they're displayed via 'Stories' format. I want to change it back to the 9-square featured photos but it's not showing me an option for that. When I edit my About/Details and choose to add more photos on th...Full ReviewSo recently my Facebook suddenly changed from featuring individual photos to 'Collections' and they're displayed via 'Stories' format. I want to change it back to the 9-square featured photos but it's not showing me an option for that. When I edit my About/Details and choose to add more photos on the 'Featured' section, it's still in the Stories format. This happened when I deleted my highlight stories and when I decided to change it back, it suddenly switched to the Collections-Story😠😠😠😠😠","February 24, 2021",94,Rated 1 stars out of five stars
4,Roosevelt McCarter,," I'm getting an error message that reads ""Something went wrong. Please try again, due to Site Maintenance on my Mobile App. I really need to keep it up-to-date so it can be running smoothly. My News Feed was going blank and I'll have to close out of the App and reopen Facebook. I'm very frustrated be...Full ReviewI'm getting an error message that reads ""Something went wrong. Please try again, due to Site Maintenance on my Mobile App. I really need to keep it up-to-date so it can be running smoothly. My News Feed was going blank and I'll have to close out of the App and reopen Facebook. I'm very frustrated because it's not responding and I really need Troubleshooting Steps to get back online. As a result, I'll have to follow instructions and get help by simply going to settings. Once I do that real quick.","February 23, 2021",1796,Rated 5 stars out of five stars
5,Bobby Singh,," Facebook is the perfect environment to stay connected. With the status updates, photos, and profile information, we can know updated information about our connected friends or relatives. Facebook helps us to know and meet new people easily. We can search for our friends with the name or mobile numbe...Full ReviewFacebook is the perfect environment to stay connected. With the status updates, photos, and profile information, we can know updated information about our connected friends or relatives. Facebook helps us to know and meet new people easily. We can search for our friends with the name or mobile number. Using Facebook, one can express one’s opinion easily and others can comment on that.","February 16, 2021",6191,Rated 5 stars out of five stars
6,Melissa McAllister,," The new similar posts page when you click on a public image (like a meme) is really annoying. It cuts off a bunch of the picture I'm trying to look at, and I have to click on the image a second time to see all of it, then go back twice just to get back to my timeline. The suggested posts for after v...Full ReviewThe new similar posts page when you click on a public image (like a meme) is really annoying. It cuts off a bunch of the picture I'm trying to look at, and I have to click on the image a second time to see all of it, then go back twice just to get back to my timeline. The suggested posts for after videos are also very annoying. I just want to scroll my timeliness, not be taken all over the place when I look at a meme or a video. I also can't move pictures into an album from inside the app.","February 12, 2021",2878,Rated 2 stars out of five stars
7,Amdadur Rahaman,," Facebook is the perfect environment to stay connected. With the status updates, photos, and profile information, we can know updated information about our connected friends or relatives. Facebook helps us to know and meet new people easily. We can search for our friends with the name or mobile numbe...Full ReviewFacebook is the perfect environment to stay connected. With the status updates, photos, and profile information, we can know updated information about our connected friends or relatives. Facebook helps us to know and meet new people easily. We can search for our friends with the name or mobile number. Using Facebook, one can express one’s opinion easily and others can comment on that.","February 20, 2021",361,Rated 5 stars out of five stars
8,Marie Carew,," An increased amount of sponsored ads on my newsfeed, i went through all setting and turned off anything I could find and still ads are showing up, i see more ads than i do of updates from friends, also my newsfeed is all over the place not in order of update from friends, i will see something posted...Full ReviewAn increased amount of sponsored ads on my newsfeed, i went through all setting and turned off anything I could find and still ads are showing up, i see more ads than i do of updates from friends, also my newsfeed is all over the place not in order of update from friends, i will see something posted 17 mins ago then next is something that was posted 2 days ago, there is just no consistency on my newsfeed, ads are just taking over, any idea on how to stop that?","February 23, 2021",51,Rated 1 stars out of five stars
9,Cory The Lucid Dreamer,," Fix this app please! I tried to log into my Facebook account too many times but it won't let me I kept getting this message ""An unexpected error occurred. Please try logging in again!"" It won't let me uninstall the app but it tells me to update it so I did but I'm still having the same problem very ...Full ReviewFix this app please! I tried to log into my Facebook account too many times but it won't let me I kept getting this message ""An unexpected error occurred. Please try logging in again!"" It won't let me uninstall the app but it tells me to update it so I did but I'm still having the same problem very frustrating the developer needs to see what's going on!","February 22, 2021",3426,Rated 1 stars out of five stars
10,Hajar EL HOUSSNI,," FACEBOOK was super great for as long as I remember. However, things has changed. I have a very old account and when I logged into it, I couldn't like, post, comment or do anything at all. I even tried to create a new account and the same issue occured. Like, seriously? I can't do anything but post s...Full ReviewFACEBOOK was super great for as long as I remember. However, things has changed. I have a very old account and when I logged into it, I couldn't like, post, comment or do anything at all. I even tried to create a new account and the same issue occured. Like, seriously? I can't do anything but post stories. I don't know if this issue happened to others too but it's so frustrating. Mind you, I didn't add people/did something against rules. I even started thinking about not using Facebook anymore.","February 17, 2021",3259,Rated 1 stars out of five stars
11,James,," Facebook Watch is missing. Everytime I watch a video on my news feed and scroll down to watch other videos it always says ""there's always more to watch. Come back for more shows and the latest episodes"" it's missing in my shortcut bar as well. Tried to enable it on settings but it's not there. The o...Full ReviewFacebook Watch is missing. Everytime I watch a video on my news feed and scroll down to watch other videos it always says ""there's always more to watch. Come back for more shows and the latest episodes"" it's missing in my shortcut bar as well. Tried to enable it on settings but it's not there. The only way to get access to watch is to google search it and open it via the app. I tried opening my girlfriend's account and watch is there. It's annoying me for weeks now. VERY DISAPPOINTED.","February 6, 2021",5758,Rated 1 stars out of five stars
12,Gavin Smith,," Whenever I try to access a page I manage, this app crashes. I've tried updating, reinstalling, rebooting and cache-clearing, all to no avail. This problem went away for a few months following one of last year's updates, then today's update brought it back. I've uninstalled this app as it's completel...Full ReviewWhenever I try to access a page I manage, this app crashes. I've tried updating, reinstalling, rebooting and cache-clearing, all to no avail. This problem went away for a few months following one of last year's updates, then today's update brought it back. I've uninstalled this app as it's completely useless to me now.","February 4, 2021",558,Rated 1 stars out of five stars
13,spicy meatball,," This app is (and has been) way too buggy for an official app. Ubiquitous ""error occurred"" messages whenever I react or comment, despite it working fine, comments fail to load randomly, the feed refreshes when it feels like, burying that post you wanted to save under a mountain of new content, the ga...Full ReviewThis app is (and has been) way too buggy for an official app. Ubiquitous ""error occurred"" messages whenever I react or comment, despite it working fine, comments fail to load randomly, the feed refreshes when it feels like, burying that post you wanted to save under a mountain of new content, the gallery/picture selection is atrocious and should just open the gallery app instead, and the list goes on. It's been like this for years. Really needs more bug fixes and more testing.","February 20, 2021",174,Rated 2 stars out of five stars
14,Dan Yavuzkurt,," GIFs can't be searched for, won't load. Most of the site is slow loading, though usually faster than accessing it in a mobile browser. often loses your page when trying to read updates. Full of most useless wow message on Earth: ""Something went wrong, please try again."" useless people you may know s...Full ReviewGIFs can't be searched for, won't load. Most of the site is slow loading, though usually faster than accessing it in a mobile browser. often loses your page when trying to read updates. Full of most useless wow message on Earth: ""Something went wrong, please try again."" useless people you may know section. By default it notifies you of every freaking thing. Ding, ding, ding. Have to change every notification individually and you might have hundreds of groups you've liked or joined.","February 12, 2021",545,Rated 1 stars out of five stars
15,John Abell Maaliw,," The new update doesn't change anything. The loading times became slower and slower. I tried to uninstall and reinstall, clear cache, clear data and force stop the app changes nothing. I'm confident that it is not by my internet connection, because instagram is normal and not facing any slow loading ...Full ReviewThe new update doesn't change anything. The loading times became slower and slower. I tried to uninstall and reinstall, clear cache, clear data and force stop the app changes nothing. I'm confident that it is not by my internet connection, because instagram is normal and not facing any slow loading when I'm browsing. Please fix that or maybe I am just he only one who encountered that problem? 😅","February 10, 2021",391,Rated 4 stars out of five stars
16,Debarati Nandan,, The application is a brilliant way to connect people but a security update of not allowing people to download pictures from someone's gallery atleast without proper permission or knowledge as to who actually have downloaded the picture. Immediate attention is needed in this part for women's safety. ...Full ReviewThe application is a brilliant way to connect people but a security update of not allowing people to download pictures from someone's gallery atleast without proper permission or knowledge as to who actually have downloaded the picture. Immediate attention is needed in this part for women's safety. Pictures are being used for wrong purposes. The lock should be from the source itself.,"February 5, 2021",1369,Rated 4 stars out of five stars
17,A Google user,, can not view in pc mode or laptope mode. the only way that half my screen in landscape mode is to not use the app and open this piece of garbgage in a browser like chrome or firefox. what a piece of junk. this problem has been around for years and they dont fix it. Check out thier support site... wh...Full Reviewcan not view in pc mode or laptope mode. the only way that half my screen in landscape mode is to not use the app and open this piece of garbgage in a browser like chrome or firefox. what a piece of junk. this problem has been around for years and they dont fix it. Check out thier support site... what a joke. good luck with that. I may just delete my account.,"February 16, 2021",2591,Rated 1 stars out of five stars
18,Em Rider,," Used to love Facebook but recently I have had problems getting push notifications, all my settings in the app and on my phone & tablet are set correctly I have done everything suggested such as uninstalling/reinstalling but nothing has worked. If I open the app I can see I have notifications on the ...Full ReviewUsed to love Facebook but recently I have had problems getting push notifications, all my settings in the app and on my phone & tablet are set correctly I have done everything suggested such as uninstalling/reinstalling but nothing has worked. If I open the app I can see I have notifications on the bell icon but obviously I don't spend all day with the app open in front of me so I am missing important notifications about events. I have reported the issue in the app but they haven't fixed it.","February 14, 2021",224,Rated 1 stars out of five stars
19,Shannon Largo,," Facebook never sends the sound of incoming notifications and it also doesn't highlight on the app my incoming notifications. I've multiple problems with it and have tried to contact Facebook themselves, but nothing is ever being done about it. I've logged out, uninstalled the app and reinstalled it ...Full ReviewFacebook never sends the sound of incoming notifications and it also doesn't highlight on the app my incoming notifications. I've multiple problems with it and have tried to contact Facebook themselves, but nothing is ever being done about it. I've logged out, uninstalled the app and reinstalled it time and time again and there are still no changes. I'm really disappointed with the problem.","February 13, 2021",340,Rated 2 stars out of five stars
20,Kotwanta Kt,," Please allow us to default the video resolution. I have limited data and watching it on my phone and on phone i dont need 720p or 1080p resolution. 360p or 480p is enough. But problem is after i set on one video, the next video still goes to 1080p. This is a simple feature and should be make availab...Full ReviewPlease allow us to default the video resolution. I have limited data and watching it on my phone and on phone i dont need 720p or 1080p resolution. 360p or 480p is enough. But problem is after i set on one video, the next video still goes to 1080p. This is a simple feature and should be make available way back. Sadly this is not the case. Also i dont shop on fb but after two or three videos of those that i am following, you start showing me videos of online shopping for the rest of my list.","February 17, 2021",92,Rated 1 stars out of five stars
21,Nazmul Haque Shakil,," I think Facebook is one of easiest platform to communicate rather than others. But the latest update brings some annoying things are really terrible, I'm pretty much hopeful they'll fixed those problems as soon as possible . Problem to be noted: #Huge number of advertisements. # Unusual feature like...Full ReviewI think Facebook is one of easiest platform to communicate rather than others. But the latest update brings some annoying things are really terrible, I'm pretty much hopeful they'll fixed those problems as soon as possible . Problem to be noted: #Huge number of advertisements. # Unusual feature like everything is business related. Fb community should more focused of people satisfaction rather than their business policies.","February 21, 2021",192,Rated 2 stars out of five stars
22,Muhammad Raihan Miah,," My phone is Redmi Note 9. At first Facebook was a very good app. But in recent times there have been some updates that have ruined our user experience. Not only that, it has become so heavy and buggy that it is now becoming quite annoying and impossible to use. And milestones can no longer be posted...Full ReviewMy phone is Redmi Note 9. At first Facebook was a very good app. But in recent times there have been some updates that have ruined our user experience. Not only that, it has become so heavy and buggy that it is now becoming quite annoying and impossible to use. And milestones can no longer be posted on Facebook pages that were there before. Hopefully Facebook will work to solve my problem and solve all the problems quickly with new updates.","February 12, 2021",368,Rated 1 stars out of five stars
23,Cameron Robbins,," Facebook market place is so hard to use. Either I can filter the options I want or search for a certain vehicle. Why can't I do both? The filters never seem to work. It just takes it as a suggestion. I ask for low mileage chevy s10s. You give me a honda civic with 200k miles. Please fix! Also, I can...Full ReviewFacebook market place is so hard to use. Either I can filter the options I want or search for a certain vehicle. Why can't I do both? The filters never seem to work. It just takes it as a suggestion. I ask for low mileage chevy s10s. You give me a honda civic with 200k miles. Please fix! Also, I can't filter the drive type of the vehicle which makes it so much harder to find what you're looking for.","February 18, 2021",110,Rated 2 stars out of five stars
24,yat,," It's good, yeah. But whenever i like a page, it would turn broken and I have to wait for minutes for my like to show up. And the last update or something, it erased the ""friends"" option in the navigation bar... and instead i have to scroll down my notifications just to accept requests from friends. ...Full ReviewIt's good, yeah. But whenever i like a page, it would turn broken and I have to wait for minutes for my like to show up. And the last update or something, it erased the ""friends"" option in the navigation bar... and instead i have to scroll down my notifications just to accept requests from friends. Meh, i also would like to have more control to personalize my account, like changing the privacy of my cover photo to ""only me"", and other stuff to personalize my friend list.","February 19, 2021",54,Rated 3 stars out of five stars
25,Angelica Katz,," If I wanted to get to messenger, I would go to my messenger app I dont want a button in the corner for me to biaccidently press to take me to the app. NO. If I want to read someone's message, if I want to be on messenger, I WILL GO THERE MYSELF. Get rid of the stupid button. One week later... I do N...Full ReviewIf I wanted to get to messenger, I would go to my messenger app I dont want a button in the corner for me to biaccidently press to take me to the app. NO. If I want to read someone's message, if I want to be on messenger, I WILL GO THERE MYSELF. Get rid of the stupid button. One week later... I do NOT WANT TO OPEN MY MESSAGES and the fact that I can now accidently click open message Im trying to ignore????? This is super super inconvenient.","February 12, 2021",377,Rated 1 stars out of five stars
26,Flavia Di Tomassi,," The few last updates have been worse and worse. More and more glitches, error messages, wall that refreshes itself to the top whilst you are trying to interact, groups that you suddenly stop being able to see, even though you are still a member .. What is even more frustrating is the total lack of c...Full ReviewThe few last updates have been worse and worse. More and more glitches, error messages, wall that refreshes itself to the top whilst you are trying to interact, groups that you suddenly stop being able to see, even though you are still a member .. What is even more frustrating is the total lack of customer service. No answers on fb or here.","February 21, 2021",1796,Rated 1 stars out of five stars
27,Russell Glidewell,, Excellent application. It is truly a informative and comprehensive solution to your needs business or personal. It does more than any other applications in this area. If you haven't explored all the different areas of this site you may be surprised. Warning...Be sure to check your settings on your p...Full ReviewExcellent application. It is truly a informative and comprehensive solution to your needs business or personal. It does more than any other applications in this area. If you haven't explored all the different areas of this site you may be surprised. Warning...Be sure to check your settings on your phone or computer after installing because the privacy settings are questionable. Don't just agree. The permissions may allow private data to be used for uploading files from your device that you don,"February 20, 2021",94,Rated 4 stars out of five stars
28,ThantSin Aung,," This latest version was bad,poor and not useful more than all old version. Why it didn't have dark mode. Why it can't use with English(United state) why only (United Kingdom ) . When I'm searching at save it was stopped and it show 2 way (Wait , close app ) .It also cause when I'm using search bar t...Full ReviewThis latest version was bad,poor and not useful more than all old version. Why it didn't have dark mode. Why it can't use with English(United state) why only (United Kingdom ) . When I'm searching at save it was stopped and it show 2 way (Wait , close app ) .It also cause when I'm using search bar to search something. I can't share videos from start to end to my story. There was stilled many problems that I forgot to told.","February 8, 2021",4921,Rated 1 stars out of five stars
29,Kelsey Stevenson,," It was working great for a long time. But now recently, while scrolling through Marketplace..... I get keeping error messages ""something went wrong. Marketplace is unavailable right now. Please check your connection and try again."" And it keeps happening when I am different places..... at home, at t...Full ReviewIt was working great for a long time. But now recently, while scrolling through Marketplace..... I get keeping error messages ""something went wrong. Marketplace is unavailable right now. Please check your connection and try again."" And it keeps happening when I am different places..... at home, at the store.","February 17, 2021",2236,Rated 2 stars out of five stars
30,Abdullah Khalid Khan,," Seriously Facebook, you should enable an option to temporarily deactivate messenger account as well in the same way it is allowed to deactivate the Facebook account. But I had no other option other than agreeing to schedule delete the messenger account within 30 days and that's so sad. Please update...Full ReviewSeriously Facebook, you should enable an option to temporarily deactivate messenger account as well in the same way it is allowed to deactivate the Facebook account. But I had no other option other than agreeing to schedule delete the messenger account within 30 days and that's so sad. Please update it in a better way. I have some personal issues with my peers, so I just wanted to keep the account inactive for some time.","February 7, 2021",682,Rated 4 stars out of five stars
