,author,developer_reply,review,review_date,reviewer_ratings,star
31,Dennis Sandoval,," My Facebook experience has always been great, but MARKETPLACE, this stupid shipping BS is ridiculous! Especially with the new update! I seach for a item and now have no option to remove the shipping items from the local sale items!!!!!! STUPID IDEA!!!! If I wanted something shipping I would never tr...Full ReviewMy Facebook experience has always been great, but MARKETPLACE, this stupid shipping BS is ridiculous! Especially with the new update! I seach for a item and now have no option to remove the shipping items from the local sale items!!!!!! STUPID IDEA!!!! If I wanted something shipping I would never trust someone off a social media platform to do so! EBAY, AMAZON, ECT. has protection like money back guarantee and returns. I ONLY WANT TO SEE LOCAL LISTINGS!!!!!!! SIMPLE!!!!!!!!!!!!!!!","February 14, 2021",184,Rated 1 stars out of five stars
32,J. Deku,," Why is it that I can't go to the page of the original post? Everytime I click on any part of the body of a post it sends me to the comment section? Is this an android feature because the iOS version doesn't have this issue. Like it's annoying when I click on a specific part of the post think I'm goi...Full ReviewWhy is it that I can't go to the page of the original post? Everytime I click on any part of the body of a post it sends me to the comment section? Is this an android feature because the iOS version doesn't have this issue. Like it's annoying when I click on a specific part of the post think I'm going to the original source, but nope, comments. Please fix this.","February 23, 2021",91,Rated 2 stars out of five stars
33,brian fielding,," App crashes pretty much every time I use it. Especially if you try to read literally any article. If you ever leave and come back, crash. Videos have way more commercials than any other app. Spies on you constantly. Can't count how many times I've talked about or ordered or searched for a product wh...Full ReviewApp crashes pretty much every time I use it. Especially if you try to read literally any article. If you ever leave and come back, crash. Videos have way more commercials than any other app. Spies on you constantly. Can't count how many times I've talked about or ordered or searched for a product while not using Facebook only to have related ads show up next time I log in. Got banned for literally calling someone a troll, no profanity or any other insults. AVOID","February 16, 2021",311,Rated 1 stars out of five stars
34,Neven Pavlova,, This social media is a trash so many bugs i can't begin to count. First i can't save most of my photos it won't let me. I can't see my likes and comments. Second when i want to see what pages I've liked there is a problem. Can't record voice messages as well and send. It used to be good but now it's...Full ReviewThis social media is a trash so many bugs i can't begin to count. First i can't save most of my photos it won't let me. I can't see my likes and comments. Second when i want to see what pages I've liked there is a problem. Can't record voice messages as well and send. It used to be good but now it's nothing but trashy and very buggy. I am considering deleting my account forever. 😉,"February 9, 2021",4099,Rated 1 stars out of five stars
35,Kelly Samuels,," I've got to say I enjoy using Facebook and it's linked to lots of different apps which is used. There are patent controls on there and age restrictions. Very helpful, lots information, allows social networking and business enterprise. All in all its just great and I really appreciate the shortcuts y...Full ReviewI've got to say I enjoy using Facebook and it's linked to lots of different apps which is used. There are patent controls on there and age restrictions. Very helpful, lots information, allows social networking and business enterprise. All in all its just great and I really appreciate the shortcuts you can add on your screen for ease of use. It makes it very easy even for people like me who didn't have a computer at school till 13 😉🌻✔️😘🙏🔯xoxo","February 11, 2021",3115,Rated 5 stars out of five stars
36,jessica malott,," Stop changing the layout for the mobile app. It is taking up too much space and no longer user friendly. I shouldnt have to go searching for my friends list, it needs to go back to being viewable on my profile instead of having to go to the about section. Also, i want to be able to just delete my po...Full ReviewStop changing the layout for the mobile app. It is taking up too much space and no longer user friendly. I shouldnt have to go searching for my friends list, it needs to go back to being viewable on my profile instead of having to go to the about section. Also, i want to be able to just delete my posts completely, not move them to the trash for 30 days. Facebook has become frustrating to use.","February 21, 2021",160,Rated 1 stars out of five stars
37,Luke,," I like Facebook and mainly use it to keep in touch with friends and for market place however market place is extremely slow and laggy. When you sell something it then takes a while as it tries to auto load the catagory for the item. Also if you select the item you lose the chat. Furthermore if you c...Full ReviewI like Facebook and mainly use it to keep in touch with friends and for market place however market place is extremely slow and laggy. When you sell something it then takes a while as it tries to auto load the catagory for the item. Also if you select the item you lose the chat. Furthermore if you click on something it loaded several pages of the item, Facebook itself is slow and runners mediocre, it doesn not load quick and also it takes a while to do anything","February 21, 2021",520,Rated 1 stars out of five stars
38,Meredith Thornton,," UPDATE Jan 2021: This has been partially fixed in that I can now reply to comments. I had no problems with the previous version but now that I have upgraded: 1. I can usually never reply to comments, regardless of the signal strength, and 2. I cannot switch easily between my page profile and my pers...Full ReviewUPDATE Jan 2021: This has been partially fixed in that I can now reply to comments. I had no problems with the previous version but now that I have upgraded: 1. I can usually never reply to comments, regardless of the signal strength, and 2. I cannot switch easily between my page profile and my personal profile and cannot always see that I am commenting as a page instead of privately i.e. I think I'm commenting privately press enter and it comes up as a page.","January 31, 2021",476,Rated 2 stars out of five stars
39,hectornumeroRD mejia,," I would like to say Facebook has the worst customer service, but they don't even have one. I lost my account because my son changed my age on the account. I've been using that account for more than 10 years and lost everything on it. I tried to send them my documents several times and they just say ...Full ReviewI would like to say Facebook has the worst customer service, but they don't even have one. I lost my account because my son changed my age on the account. I've been using that account for more than 10 years and lost everything on it. I tried to send them my documents several times and they just say they can't review because of covid quarentine. Is there a way to reach out to you, Facebook?","February 23, 2021",13,Rated 1 stars out of five stars
40,K L,, Using this app is next to useless on a tablet where 99.9% of the time it's in landscape mode with the auto rotation turned off. This stupid app still insists on rotating the screen into portrait mode when viewing photo albums or a story. It will not stayed locked in landscape mode and apparently thi...Full ReviewUsing this app is next to useless on a tablet where 99.9% of the time it's in landscape mode with the auto rotation turned off. This stupid app still insists on rotating the screen into portrait mode when viewing photo albums or a story. It will not stayed locked in landscape mode and apparently this 'feature' has been going for years. Uninstalled and good riddance.,"February 14, 2021",158,Rated 1 stars out of five stars
41,Ell Gee,," Can no longer access my photo albums in my profile through the app. Also when trying to add a photo as a comment to a discussion it doesn't give the option on android to search your albums on your phone, but instead just gives access to all your photos on your device in no logical order, making find...Full ReviewCan no longer access my photo albums in my profile through the app. Also when trying to add a photo as a comment to a discussion it doesn't give the option on android to search your albums on your phone, but instead just gives access to all your photos on your device in no logical order, making finding photos extremely hard and time consuming. Now keeps booting me out of my account every few days, so I have to recover it via the main Website and create a new password each time. Get it sorted!","February 13, 2021",396,Rated 1 stars out of five stars
42,Luwanda Overman,," I just got a new android phone and I cannot log into the Facebook app. I know my password. It says it does not recognize my phone number, email address, or my name, and it says my password is wrong. However, when I go to Google Chrome, I can log in with no problem using the browser. Trying to find h...Full ReviewI just got a new android phone and I cannot log into the Facebook app. I know my password. It says it does not recognize my phone number, email address, or my name, and it says my password is wrong. However, when I go to Google Chrome, I can log in with no problem using the browser. Trying to find help for the app issue has been ridiculous as it seems there is no way to contact anyone to help with my issue. I refuse to create a new account. 2 big thumbs down Facebook!","February 8, 2021",528,Rated 1 stars out of five stars
43,Abbas Imran,, Marketplace used to be so good but now its just an inconvenience. Usually when i message someone about an item im interested in i could click see details and see the item but now they removed that feature so if i want to see the item again i need to find it again on marketplace which is time consumi...Full ReviewMarketplace used to be so good but now its just an inconvenience. Usually when i message someone about an item im interested in i could click see details and see the item but now they removed that feature so if i want to see the item again i need to find it again on marketplace which is time consuming. If they bring back that feature this would be very beneficial to me.,"February 22, 2021",150,Rated 1 stars out of five stars
44,Greg Cordle,," Here's the problem. I update app here on Google Play. Then sometime later my Note 8 will show an update notification that's NOT from Google Play but fron the app itself. It will keep doing this forever until another update is published here. Also, if I try to let it update, it downloads, then shows ...Full ReviewHere's the problem. I update app here on Google Play. Then sometime later my Note 8 will show an update notification that's NOT from Google Play but fron the app itself. It will keep doing this forever until another update is published here. Also, if I try to let it update, it downloads, then shows verifying forever and just keeps running verifying. If you hit cancel, it showed a popup about canceling but goes back to updating again before you can even press a button. PLEASE FIX THIS...","February 5, 2021",197,Rated 1 stars out of five stars
45,David,, I had 2 factor auth on my account and my account was still somehow hacked. Facebook support doesn't exist and my only option is to submit a ticket which seems to go to nobody and there's no way to check the status on the ticket. I haven't heard back in a month. I've read lots of other people experie...Full ReviewI had 2 factor auth on my account and my account was still somehow hacked. Facebook support doesn't exist and my only option is to submit a ticket which seems to go to nobody and there's no way to check the status on the ticket. I haven't heard back in a month. I've read lots of other people experienced this recently as well. So be ready to lose your 10 year account to a hacker who could take advantage of your friends and family with no chance of recovery.,"February 15, 2021",674,Rated 1 stars out of five stars
46,DJ RICK LIVE,, You can't play any music. or you get muted stop block. organic share is way down too many adds. and has it goes for DJ S. If your page has a BLUE badge. you can livestream. only for famous DJs. but if your a regular DJ for 5 year. to 30 years. you can not DJ. You get. muted. block. page deleted and ...Full ReviewYou can't play any music. or you get muted stop block. organic share is way down too many adds. and has it goes for DJ S. If your page has a BLUE badge. you can livestream. only for famous DJs. but if your a regular DJ for 5 year. to 30 years. you can not DJ. You get. muted. block. page deleted and your profile. SHOULD BE RULE SAME FOR EVERYONE. or let people share music to friends and. family. music is everyone part of life to share more then just photos.. and too. many adds,"February 18, 2021",340,Rated 1 stars out of five stars
47,Christine Zangari,," I use this app every day. Minimal problems, occassional glitches, but what app doesn't have its glitches from time to time? Desent app, always room for improvement like being able to delete your own pictures. Seems fb takes your photos hostage unless they're in a post. Should be able to delete any c...Full ReviewI use this app every day. Minimal problems, occassional glitches, but what app doesn't have its glitches from time to time? Desent app, always room for improvement like being able to delete your own pictures. Seems fb takes your photos hostage unless they're in a post. Should be able to delete any content we put on the site. They are ours.","February 16, 2021",97,Rated 5 stars out of five stars
48,haquemsh sinan,," Facebook, you have logged me out from my own account. You have wanted some information and I gave it to you but then you made me change my password yet still when I try to log in it keeps showing error. I can't even use Instagram now. That is totally disturbing and wrong. Please fix this problem and...Full ReviewFacebook, you have logged me out from my own account. You have wanted some information and I gave it to you but then you made me change my password yet still when I try to log in it keeps showing error. I can't even use Instagram now. That is totally disturbing and wrong. Please fix this problem and let me use my account, give me my account back .","February 21, 2021",147,Rated 3 stars out of five stars
49,Kimberly Schultz,," The past few days it's gone totally bizarre. It keeps going back to the top whenever I click on anything. It's not refreshing correctly. Posts and pictures aren't loading fully and it wouldn't load a simple gif from their own options saying ""the video"" couldn't load on this platform. Maybe spend mor...Full ReviewThe past few days it's gone totally bizarre. It keeps going back to the top whenever I click on anything. It's not refreshing correctly. Posts and pictures aren't loading fully and it wouldn't load a simple gif from their own options saying ""the video"" couldn't load on this platform. Maybe spend more time tending to your product vs. pushing the phoney checkers who are always wrong.","February 16, 2021",171,Rated 3 stars out of five stars
50,Anon ymous,," The opt-out settings are designed against the user. I opt out of everything and they still collect my data. Do I really have to go through interest categories and remove them manually every day? Facebook also injects their own ads into the built in web browser. Slimy tactics, I look forward to the d...Full ReviewThe opt-out settings are designed against the user. I opt out of everything and they still collect my data. Do I really have to go through interest categories and remove them manually every day? Facebook also injects their own ads into the built in web browser. Slimy tactics, I look forward to the day social media won't be monopolized by them.","February 23, 2021",29,Rated 1 stars out of five stars
51,Jordon,," facebook has 3 tabs for posts: home, favorites and recent. All Ive wanted for years now is a way to set it to ""recent"" permanently. Which is messed up because we used to have that and they took it away. Im sick of the way this app operates like a toddler having a seizure when asked to load posts in ...Full Reviewfacebook has 3 tabs for posts: home, favorites and recent. All Ive wanted for years now is a way to set it to ""recent"" permanently. Which is messed up because we used to have that and they took it away. Im sick of the way this app operates like a toddler having a seizure when asked to load posts in a group. Im sick of the constant reminders to add my phone number or other infornation. Im sick of the lack of support when they break something and I need help getting back into their app. Im done.","February 21, 2021",4290,Rated 1 stars out of five stars
52,Chris Mccolm,," So obviously Facebook is awesome. But my 1 star review is for the simple fact that you can't click on multiple messages to delete them. You have to delete EVERY message INDIVIDUALLY, which is crazy. It is 2020, every program EXCEPT the billion dollar Facebook can do this simple feature. Please fix!!...Full ReviewSo obviously Facebook is awesome. But my 1 star review is for the simple fact that you can't click on multiple messages to delete them. You have to delete EVERY message INDIVIDUALLY, which is crazy. It is 2020, every program EXCEPT the billion dollar Facebook can do this simple feature. Please fix!! EDIT.. So it has been over a year since I rated it last. And no changes since 🤷🏼‍♂️ Is it just me who likes this feature to delete multiple messages at once?","February 14, 2021",87,Rated 2 stars out of five stars
53,Avery Games,," Badly managed and glitchy. If somebody is out to ruin you they can easily do this Facebook has removed their customer support completely. if your account gets hacked the only thing you can do is delete your account and make a new one. Also, Facebook has no customer support like I mentioned, so if so...Full ReviewBadly managed and glitchy. If somebody is out to ruin you they can easily do this Facebook has removed their customer support completely. if your account gets hacked the only thing you can do is delete your account and make a new one. Also, Facebook has no customer support like I mentioned, so if somebody wants to report you if they even get the slightest bit offended at what you say, they can and the Facebook will side with them no matter how ridiculous it is...","February 8, 2021",524,Rated 1 stars out of five stars
54,Justin Vieira,," Everything great but... On the facebook app everything works great, feed, groups, notifications, everything, only thing I'm having any issues with is marketplace, i love marketplace but whenever I save a speech filter for cars and set reminders on updates, I get no updates, to make it even worse if ...Full ReviewEverything great but... On the facebook app everything works great, feed, groups, notifications, everything, only thing I'm having any issues with is marketplace, i love marketplace but whenever I save a speech filter for cars and set reminders on updates, I get no updates, to make it even worse if I click on my saved search it doesn't let me see listings like it says. I think marketplace should have it's own app, love marketplace better than Kijiji, hope this big gets fixed.","February 13, 2021",141,Rated 3 stars out of five stars
55,marjorie macaraig,, This happens to me many times. the app is not working and I need to use a mobile data since I can't use it using the wifi. One day it's fine and now it's not working again. Even if I reinstall it. Same thing happens all ovee again,"February 20, 2021",9,Rated 1 stars out of five stars
56,Eisenheim Ilst,," I can no longer add a 3D photo on my feed. And also.......this app can listen in to what you're saying. I had mentioned joining the USAF to someone the other day. And guess what......I started seeing USAF ads on my FB feed the following day. I NEVER searched for anything that had to do with the USAF...Full ReviewI can no longer add a 3D photo on my feed. And also.......this app can listen in to what you're saying. I had mentioned joining the USAF to someone the other day. And guess what......I started seeing USAF ads on my FB feed the following day. I NEVER searched for anything that had to do with the USAF. Not on FB, and not on Google. No privacy whatsoever. Uninstalling?? Yes.","February 7, 2021",2869,Rated 1 stars out of five stars
57,Mike Josephson,," Currently cannot fix any privacy settings,had them all off and now I get ads again from them looking at offline activity. All those billions you would think they can make an app work correctly. FIX IT. So now we are on 4 weeks of not being able to change privacy setting I had shutoff, that got turne...Full ReviewCurrently cannot fix any privacy settings,had them all off and now I get ads again from them looking at offline activity. All those billions you would think they can make an app work correctly. FIX IT. So now we are on 4 weeks of not being able to change privacy setting I had shutoff, that got turned back on without consent..getting ads for all stuff I search off of Facebook. You need to fix security settings.","February 20, 2021",71,Rated 1 stars out of five stars
58,Bobby S,," Censorship on a level of absurdity, frustrating, biased, and without recourse. Text taken out of context and made to be hate or bullying. The amount of ads has increased exponentially. Littered with propaganda and political correctness consuming most articles or posts. Friends posts are frequently m...Full ReviewCensorship on a level of absurdity, frustrating, biased, and without recourse. Text taken out of context and made to be hate or bullying. The amount of ads has increased exponentially. Littered with propaganda and political correctness consuming most articles or posts. Friends posts are frequently missing in news feeds, which has become commercial feeds. So sad to see this application falling so far and so fast.","February 21, 2021",172,Rated 1 stars out of five stars
59,RISEANDFALL,," Facebook is facebook. The app is nothing special but a little easier then facebook on a regular web browser, I think. A more customizable set of options, themes and colors kind of thing, would be cool, but it is what it is. Only 4 stars because I've been trying to join the damn beta version for as l...Full ReviewFacebook is facebook. The app is nothing special but a little easier then facebook on a regular web browser, I think. A more customizable set of options, themes and colors kind of thing, would be cool, but it is what it is. Only 4 stars because I've been trying to join the damn beta version for as long as I've used Facebook!!!","February 18, 2021",176,Rated 4 stars out of five stars
60,Fanny Eliza,," The app keeps kicking me out. I tried to unistalled it, and download it again and nothing seems to work. It's so frustrating I've never had any issues with it until now. My marketplace won't load, the app crashes. I try to get back in and it kicks me out within seconds of getting in. Please fix it😠...Full ReviewThe app keeps kicking me out. I tried to unistalled it, and download it again and nothing seems to work. It's so frustrating I've never had any issues with it until now. My marketplace won't load, the app crashes. I try to get back in and it kicks me out within seconds of getting in. Please fix it😠😠","February 9, 2021",94,Rated 1 stars out of five stars
61,Ansis Kristiāns Dāboliņš,," To be honest the app is great. It serves it's functions very well. However, I don't trust it. There's alot of rumors of it being able to turn on your microphone even if you disabled it in settings, the same with camera and so on...FB is not something i would recommend. Linkedin is better","February 12, 2021",222,Rated 1 stars out of five stars
62,Sarah Deming,," I used to love this app. But now I can't stand it. It has been taking soooooo long to load. Literally I click on a notification and it takes anywhere from 1 to 3 mins to load. It is so frustrating. I've restarted, closed it, logged out, checked my connection, etc. No resolution.","February 11, 2021",1293,Rated 1 stars out of five stars
63,Cory Hennelly,," News feed just repeats the same few posts from previous day/days ... Other then that it's all adds, used to enjoy marketplace but that's more adds then not .. updated my app, uninstalled/reinstalled countless times to try and correct the glitches and it's still the same , mine is updated to current ...Full ReviewNews feed just repeats the same few posts from previous day/days ... Other then that it's all adds, used to enjoy marketplace but that's more adds then not .. updated my app, uninstalled/reinstalled countless times to try and correct the glitches and it's still the same , mine is updated to current but still don't have dark mode like everyone else. Ppl who have low end phones even have it .. thinking about deleting the app .","February 5, 2021",218,Rated 2 stars out of five stars
